ImpactMind AI,https://www.crunchbase.com/organization/impactmind-ai,,,Active,For Profit,,"We're an AI automation consulting firm that specializes in streamlining and automating business processes.  We offer a range of core services, including AI-driven content creation, building conversational AI for various purposes (such as prospecting, onboarding, customer service, and staff training), and data analysis.",,2023-07-21,day,"Artificial Intelligence (AI), Consulting, Software","Sheridan, Wyoming, United States","ImpactMind AI leads in AI business process automation consulting for content creation, conversational AI, and data analysis.","324,126",,,,,,,,,,https://www.impactmind.ai,Western US,,https://twitter.com/impactmindai,,https://www.linkedin.com/company/impactmind,,,,,,2,11-50,"Surapong Kanoktipsatharporn, Worawisut Pinyoyang"
WORLD PROPERTY VENTURES,https://www.crunchbase.com/organization/world-property-ventures,,,Active,For Profit,,"WORLD PROPERTY VENTURES is a global real estate developer – but in the digital realm of real estate. Much as ‘brick and mortar’ real estate developers create significant shareholder value by building physical assets (Office buildings, Warehouses, Retail, Apartments, Homes, Condos, etc…), WPV creates shareholder value by building digital assets for the $300 trillion-dollar addressable global real estate industry. The types of digital assets WPV develops include: • Digital Infrastructure – A.I. powered real estate Marketplaces, Search Engines, MLSs and Exchanges • Information Platforms – Real Estate News, Data, Ontology and Signals Intelligence platforms • Transaction Services – Real Estate tokenization, dynamic pricing, digital mortgages and transaction management services Our goal is to create significant shareholder value by heavily leveraging AI, Data, Innovation and Automation to build the world’s digital real estate infrastructure and platforms of tomorrow – today.",,2024-01-19,day,"Artificial Intelligence (AI), Big Data, Business Information Systems, Business Intelligence, FinTech, Information Technology, News, PropTech, Real Estate, Real Estate Investment","Miami, Florida, United States","WORLD PROPERTY VENTURES is a global developer, owner and operator of a portfolio of market disruptive property technology companies.","325,736",,,,,,,,,,https://www.worldpropertyventures.com/,"Greater Miami Area, East Coast, Southern US",,,,https://www.linkedin.com/company/world-property-ventures/,,,,,,1,11-50,Michael Gerrity
Leveragai,https://www.crunchbase.com/organization/leveragai,,,Active,For Profit,,"Leveragai is an AI-driven company that specializes in product development, consultancy, and training. They provide a wide range of solutions for any data-driven company, at competitive prices. In addition to their comprehensive services, Leveragai is also proud to offer individual bootcamps and corporate or group trainings. Whatever your needs, Leveragai is the perfect choice to provide you with the tools you need to stay ahead of the competition. With their cutting-edge technology and unbeatable pricing, Leveragai is the way to go when it comes to achieving success in the world of AI.",,2023-06-01,day,"Artificial Intelligence (AI), Consulting, Corporate Training, CRM, Finance, Health Care, Machine Learning, Training","Baltimore, Maryland, United States","Artificial Intelligence, Consultancy, Solutions/Product, Data Science Training with a Domain (Finance, Healthcare, and CRM)","328,549",,,,,,,,,,https://leveragai.com,"Greater Baltimore-Maryland Area, East Coast, Southern US",,https://twitter.com/leveragai,,https://www.linkedin.com/company/leveragai.com,,,,,,,1-10,
Zhero Ecocloud,https://www.crunchbase.com/organization/zhero-ecocloud,,,Active,For Profit,,"Zhero Ecocloud is an ESG Platform that provides AI powered sustainability solutions. AI, Blockchain, and IoT-powered platform to businesses implementing ESG Strategies.",,2023-05-02,day,"Artificial Intelligence (AI), Blockchain, Consulting, Internet of Things, Software, Sustainability","Dover, Delaware, United States",Zhero Ecocloud is an ESG Platform that provides AI powered sustainability solutions.,"337,109",,,,,,,,,,https://zheroecocloud.com,"East Coast, Southern US",,https://twitter.com/zheroecocloud,https://www.facebook.com/profile.php?id=100092373372662,https://www.linkedin.com/company/zhero-ecocloud,,,,,,1,1-10,Maria Jorgelina Pera
Namely AI,https://www.crunchbase.com/organization/namely-AI,70,1,Active,For Profit,,"We are an AI-powered sales assistant that handles both inbound and outbound sales calls. During calls, our technology identifies pain points, pitches products, schedules demos, and sends a summary to the sales representative. By automating the sales process, our solution eliminates the need for hiring and training entry-level sales representatives, saving time and money for businesses.",,2023-03-20,day,"Artificial Intelligence (AI), B2B, SaaS, Sales","Austin, Texas, United States",Transforming Sales with Al Efficiency,"339,537",,,,,,,,,,https://www.NamelyAI.com,Southern US,,,,https://www.linkedin.com/company/NamelyAI,,,,,,2,1-10,"Anton Vice, Zac Nicholson"
Blackwire Labs,https://www.crunchbase.com/organization/blackwire-labs,,,Active,For Profit,,"Blackwire Labs is committed to combating the erosion of trust in AI-language models (LLMs) while addressing the pervasive shortage of cybersecurity expertise. Blackwire utilizes comprehensive multi-modal approach to address the trust issues associated with AI in cybersecurity, enabling defensible and immediately actionable solutions.",,2023-10-01,day,"Artificial Intelligence (AI), Cloud Security, Cyber Security, Generative AI, Network Security, SaaS","Reston, Virginia, United States","AI, SaaS, Cybersecurity, Information Technology","340,794",,,,,,,,,,https://blackwirelabs.com/,"Washington DC Metro Area, East Coast, Southern US",,https://twitter.com/blackwirelabs,,https://www.linkedin.com/company/blackwire-labs/,,,,,,1,1-10,Matt Devost
Transposed AI,https://www.crunchbase.com/organization/transposed-ai,,,Active,For Profit,,"Make music, Faster. Meet best-in-class GenAI blended with legal licensing automation. Enabling hassle-free commercial AI vocal sampling and production, all while allowing creators to find the perfect sound for their song, fast. Transposed AI creates new revenue streams for artists, unleashing their unique vocal style to a community of professional creators.",,2023-05-01,day,"Audio Recording and Production, Generative AI, Music","Lewes, Delaware, United States",Best-in-class GenAI blended with legal licensing automation. Leverage AI models of artist voices for hassle-free commercial vocal production,"340,968",,,,,,,,,,https://www.transposed.ai,"East Coast, Southern US",,https://twitter.com/TransposedAI,,https://www.linkedin.com/company/transposedai,,,,,,1,1-10,Daniel Campbell
Glober AI,https://www.crunchbase.com/organization/glober-ai,,,Active,For Profit,,,,2023-08-01,day,"Advertising, Artificial Intelligence (AI), Digital Marketing, Machine Learning, Natural Language Processing, Translation Service","Los Altos, California, United States",Revolutionizing SaaS Platform that magically crafts authentic and multicultural contents at lightning speed,"341,012",,,,,,,,,,https://www.glober.ai/,"San Francisco Bay Area, Silicon Valley, West Coast",,,,,,,,,,2,1-10,"Chris Yang, Felix Zhou"
Vidura Labs inc,https://www.crunchbase.com/organization/vidura-labs-inc,"8,513",,Active,For Profit,,"Vidura is an AI technology company specializing in prompt management systems. Our user-friendly interface simplifies prompt organization and collaboration, empowering users to streamline workflows and boost productivity. Our system caters to individuals and businesses across industries, fostering a vibrant community for idea sharing. With significant user growth and funding opportunities, we're committed to expanding our product offerings and fueling market growth. Led by our experienced co-founders, our team brings expertise in AI, software development, and business analysis. Our customers have reported enhanced organization, streamlined collaboration, and improved efficiency. Our future roadmap includes continuous innovation, new features, seamless integrations, and AI-driven advancements in prompt management.",,2023-05-11,day,"Artificial Intelligence (AI), Information Technology, Productivity Tools, Software","San Francisco, California, United States",Innovators in prompt management systems. Simplifying organization & collaboration for enhanced productivity.,"341,433",,,,,,,,,,https://vidura.ai,"San Francisco Bay Area, West Coast, Western US",,https://twitter.com/ViduraAi,https://www.facebook.com/viduraai,https://www.linkedin.com/company/94234096/admin/feed/posts/,,,,,,2,1-10,"Saikiran Yellavula, Zahra Zaredar"
Deal Tracker,https://www.crunchbase.com/organization/deal-tracker,,,Active,For Profit,,"Deal Tracker redefines real estate investment with its pioneering approach, blending comprehensive real estate data, advanced artificial intelligence (AI), and intelligent tools into a single, powerful platform. Our unique offering doesn't just simplify property investment; it transforms it by merging real estate data with non-real-estate datasets to uncover hidden correlations, offering insights previously unseen in the market. With Deal Tracker, investors gain access to advanced data visualization features and can either view enriched real estate data interactively or receive a raw data feed of all active listings, making it effortless to identify lucrative investment opportunities. Our platform stands out by providing all necessary financials pre-calculated and enriching real estate data so investors no longer need to gather information from disparate sources. This seamless integration ensures that every investment decision is informed and every opportunity is tailored to individual financial goals. We elevate the investment process by allowing users to apply a myriad of filters, from location specifics to financial metrics, ensuring a match to their precise investment criteria. Deal Tracker interprets and presents key financial ratios and insights, tailored to each user’s strategy, whether buying in cash or through a mortgage. Daily updates on listings, market trends, and price adjustments keep investors ahead, offering a competitive edge in a dynamic market. Deal Tracker is not just another tool; it's a comprehensive ecosystem designed for the modern investor. It represents the next evolution in real estate investment, where data depth, AI intelligence, and user-centric tools converge, providing a new type of solution that ensures success in the real estate market. Join us to experience the future of real estate investment, where decisions are smarter, opportunities are personalized, and investment potential is maximized.",,2023-03-01,month,"Artificial Intelligence (AI), Big Data, PropTech, Real Estate, Software","Los Angeles, California, United States","A Unique Fusion of Real Estate Data, AI, and Intelligent Tools.","341,438",,,,,,,,,,https://dealtracker.ai,"Greater Los Angeles Area, West Coast, Western US",,https://twitter.com/DealTrackerAI,,https://www.linkedin.com/company/dealtracker,,,,,,1,1-10,Lev Ivanov
WaysToTrade,https://www.crunchbase.com/organization/waystotrade,,,Active,For Profit,2023-06-28,"We rank the best trading strategies used by daily traders. WTT is the most advanced AI system to analyze trading strategies. Gain exclusive access to the strategies, indicators and insights of over 500 traders. Learn from who is doing it already. Find all the insights you need to trade for each stock.",Pre-Seed,2023-06-28,day,"Artificial Intelligence (AI), Big Data","New York, New York, United States",We rank the best trading strategies used by daily traders,"342,216",,,,,USD,,,,,https://waystotrade.com/,"Greater New York Area, East Coast, Northeastern US",,https://twitter.com/waystotrade,https://www.facebook.com/waystotrade/,https://www.linkedin.com/company/83052544/,,,,,,1,1-10,Marco Visibelli
Diijobs.ai,https://www.crunchbase.com/organization/diijobs-ai,,,Active,For Profit,,Diijobs.ai aims to streamline the job search process using advanced AI algorithms. We address the challenges job seekers face by aggregating job listings from diverse sources & offering a one-stop-shop for all job seekers' needs,,2023-11-30,day,"Artificial Intelligence (AI), Recruiting, Search Engine","Austin, Texas, United States","Making the process of finding, preparing for and applying for jobs much better for job seekers; the one-stop-shop for all job seekers' needs","344,873",,,,,,,,,,https://diijobs.ai,Southern US,,,,https://www.linkedin.com/company/diijobs-ai/,,,,,,,1-10,
Breacher.ai,https://www.crunchbase.com/organization/breacher-ai,,,Active,For Profit,,"We help businesses protect employees from emerging AI threats like Deepfake Audio, Video and SMS Phishing through cyber security training and testing. Our fully managed mobile platform helps address threats on mobile devices and gives employees a channel to report SMS based phishing.",,2023-09-22,day,"Artificial Intelligence (AI), Cyber Security","Orlando, Florida, United States",SaaS Cybersecurity / AI Deepfake Awareness Testing & Simulation.,"346,286",,,,,,,,,,https://www.breacher.ai/,"East Coast, Southern US",,https://twitter.com/breacherai,,https://www.linkedin.com/company/breacher-ai/,,,,,,,1-10,
Synthine,https://www.crunchbase.com/organization/synthine,,,Active,For Profit,,"Synthine's primary goal is data democratization—we offer an AI-powered conversational assistant for businesses and individuals that integrates proprietary data and can then answer any type of general or technical question about it. It is web connected, has minimal hallucinations, and can be customized for particularly complex data.",,2023-08-25,day,"Artificial Intelligence (AI), Business Intelligence, Data Integration, Software","San Francisco, California, United States",Synthine is a Data-as-a-Service platform that leverages GenAI for advanced and secure data analytics across proprietary data.,"347,919",,,,,,,,,,https://www.synthine.ai/,"San Francisco Bay Area, West Coast, Western US",,,,https://www.linkedin.com/company/synthine/?viewAsMember=true,,,,,,2,1-10,"Christopher Fitzgerald, Nicholas Van Landschoot"
Muraena,https://www.crunchbase.com/organization/muraena,,,Active,For Profit,,"Muraena is a Sales Intelligence platform designed to streamline the lead generation process for small sales teams. With AI-driven targeting, businesses get precise B2B leads without the complexity of traditional systems.",,2023-09-01,month,"Artificial Intelligence (AI), Lead Generation, Sales Automation","San Francisco, California, United States",B2B database of 720M sales leads with AI-Powered Search,"348,698",,,,,,,,,,https://muraena.ai,"San Francisco Bay Area, West Coast, Western US",,,,https://www.linkedin.com/company/muraena/,,,,,,,1-10,
SoftwareAgent.ai,https://www.crunchbase.com/organization/softwareagent-ai,,,Active,For Profit,,"SoftwareAgent.ai's mission is to expedite human progress in software by fostering innovation without barriers through automating the entire software development lifecycle using AI and Generative AI. By leveraging generative AI and large language models, we impart unprecedented efficiency, reliability, and scalability to the software development lifecycle. This technology-infused approach eliminates the barriers of traditional development, such as time constraints and human error, thus enabling companies to rapidly and affordably convert their visions into robust software solutions. Our solution not only improves the quality and cost-effectiveness of software but also fosters an environment conducive to unfettered technological advancement. At SoftwareAgent.ai, we believe in breaking down barriers to innovation, allowing ideas to thrive in a landscape shaped by AI-driven software creation.",,2023-07-01,day,"Artificial Intelligence (AI), Generative AI, Machine Learning, Natural Language Processing, Software","San Jose, California, United States",SoftwareAgent.ai automates the entire software development lifecycle via AI and generative AI,"351,663",,,,,,,,,,https://www.softwareagent.ai/,"San Francisco Bay Area, Silicon Valley, West Coast",,,,https://www.linkedin.com/company/software-agent-ai/,,,,,,1,1-10,Adnan Boz
Scroll,https://www.crunchbase.com/organization/scroll-41e7,,,Active,For Profit,,"Scroll is your AI-powered news oasis – concise, unbiased, and under 50 words. We're not just about news; we're bringing back the true essence of social networking, connecting you with like-minded individuals. Plus, every post has the power to generate revenue!",,2023-06-24,day,"Artificial Intelligence (AI), News, Social Media, Social Network, Social News","New York, New York, United States",AI powered news aggregator & social networking,"351,687",,,,,,,,,,https://scroll.news/,"Greater New York Area, East Coast, Northeastern US",,,,,,,,,,1,1-10,Anurag Khona
Ivyngton,https://www.crunchbase.com/organization/cesi-f9b9,,,Active,For Profit,,"Ivyngton means personalized insurance, just for you. The insurance maze has left many feeling lost, unheard, and undervalued. That's why Ivyngton is here to chart a new course. Ivyngton transforms the insurance landscape with an innovative AI-enabled approach. Personalizing each policy: Everyone is unique, with distinct needs and concerns. At Ivyngton, we believe your insurance should reflect just that. Instead of providing a generic policy, our advanced 63B parameter insurance quote model is designed to understand and cater to your specific requirements. This not only ensures that you're covered for what truly matters to you but also provides us with precise insights into the risk profiles of the policies we craft for each individual. Assured insurance: We are the only insurance company which will pay your claim even if the underwriter refuses to. If your claim isn't paid by our underwriters, we step in. Our legal team fights for all unpaid claims, no matter how small, and we charge only 20% of the recovered amount. Lower risk: Instead of confusing terms and hidden fees like traditional insurance companies, we only take 30% of premiums as profit and give the remaining 70% to our underwriters. In return, these underwriters shoulder 100% of the risk. AI-categorized policies: By harnessing the power of our models, we offer underwriters precise risk categorization for millions of personalized policies. This means faster approvals, fewer denials, and more accurate pricing for customers. Transparent, accessible, and efficient: Our customer dashboard is an instant one-stop-shop for all of your policies, whether taken out by you or your employer, saving you time and stress, allowing you easy one-click claims and one-click access of all of your documents. Experience the difference of having assurance beyond insurance. Say Goodbye to nightmare experiences and Hello to an ally in your corner.",,2023-09-08,day,"Artificial Intelligence (AI), Insurance, Software","Altamonte Springs, Florida, United States",The trusted ally for specialized insurance tailored to your needs,"354,858",,,,,,,,,,https://ivyngton.com,"East Coast, Southern US",,https://twitter.com/ivyngton,,https://www.linkedin.com/company/ivyngton/,,,,,,1,1-10,Gabriel Saint-Martin
MagicDoor,https://www.crunchbase.com/organization/magicdoor,,1,Active,For Profit,,"MagicDoor is revolutionizing property management through our comprehensive Cloud Property Management Platform, designed to be the ultimate tool for property managers. Our platform offers a streamlined solution that encompasses every aspect of property management, including efficient rent collection, extensive property listings, thorough tenant screening, organized maintenance requests, and sophisticated accounting and reporting capabilities. Our platform stands out with a full-featured tenant communication system that facilitates seamless interaction via app, email, or text, reminiscent of Slack's user-friendly interface. At the core of MagicDoor is a commitment to innovation through integrated AI, which permeates all our systems, ensuring property managers spend less time on routine tasks and more on scaling their portfolios. Our user-centric approach is geared towards enhancing productivity and simplifying operations, making property management a hassle-free experience. MagicDoor isn't just a service provider; we're a growth partner for property managers looking to leverage technology for a competitive edge. With MagicDoor, property management is not only about managing assets but also about unlocking potential.",,2023-06-01,day,"Accounting, Artificial Intelligence (AI), FinTech, Property Management, Real Estate, Rental Property","Las Vegas, Nevada, United States",AI-driven platform streamlining property management and tenant engagement,"356,181",,,,,,,,,,https://www.magicdoor.com,Western US,,,,https://www.linkedin.com/company/magicdoorinc,,,,,,2,1-10,"Kasper Rune Sogaard, Yingmei Sogaard"
TrueName,https://www.crunchbase.com/organization/truename,,,Active,For Profit,2023-12-01,"TrueName builds AI-enabled research tools for investing, intelligence, and legal research. The core technology we are developing is the Tacit Knowledge Engine. The engine uses generative AI to extend explicit recorded knowledge to include implicit knowledge which may only be produced by reasoning over information from separate sources. The engine pairs superior retrieval techniques with just-in-time reasoning, allowing the user to tap a virtual store of knowledge which is not available publicly.",Angel,2023-04-01,month,"Artificial Intelligence (AI), Financial Services, Legal Tech, Market Research","Wilmington, Delaware, United States","Generative AI Knowledge Engine for Intelligence, Investing, and Legal Research","362,717",,,,,USD,,,,,https://truename.ai,"Greater Philadelphia Area, East Coast, Southern US",,,,,,,,,,1,1-10,Kevin Muto
Real Estate Assistant AI,https://www.crunchbase.com/organization/real-estate-assistant-ai,,,Active,For Profit,,,,2023-08-23,day,"Artificial Intelligence (AI), Real Estate","Austin, Texas, United States",AI & Human Agents for the Real Estate Industry,"366,629",,,,,,,,,,https://www.realestateassistant.ai,Southern US,,,,https://www.linkedin.com/company/realestateassistantai,,,,,,2,1-10,"Hunter Gregg, Kaihuan Huang"
Just Think AI,https://www.crunchbase.com/organization/just-think-ai,,,Active,For Profit,,"All-in-one AI toolkit for Educators and Entrepreneurs. Seamlessly combine AI chat, text-to-speech, art generation, and video creation. Engage in natural conversations, turn text into audiobooks, create stunning visuals, and make videos.",,2023-03-20,day,"Artificial Intelligence (AI), EdTech, Education, SaaS","Dallas, Texas, United States",All-in-one AI toolkit for Educators and Entrepreneurs,"368,333",,,,,,,,,,https://justthink.ai,"Dallas/Fort Worth Metroplex, Southern US",,https://twitter.com/@Justthinkai,https://facebook.com/justthink,https://www.linkedin.com/company/just-think-ai,,,,,,1,1-10,James McDowell
the data_science academy,https://www.crunchbase.com/organization/the-data-science-academy,,,Active,For Profit,,"Upskill workforce. Reduce turnover. Increase productivity. `the data science academy` is a company specialized in providing in-company training for Artificial Intelligence, Data Science and Data Enginering for any audience.    Our trainings are custom-made to fit your very unique needs, technologies, projects and background.  We provide much more than just a training.  Trainings designed to any profile, any background, any professional. Hands-on trainings 'bootcamp style'. Just enought theory. 85% Practical 15% Theory. Add value to your organization by developing your own projects with your own day-to-day data.",,2023-09-01,day,"Artificial Intelligence (AI), Business Intelligence, EdTech, Machine Learning","Austin, Texas, United States","EdTech, In-Company training","368,639",,,,,,,,,,https://thedatascience.academy/,Southern US,,,,https://www.linkedin.com/company/the-data-science-academy/,,,,,,1,1-10,Pablo Moreno
Summio,https://www.crunchbase.com/organization/summio,,,Active,For Profit,,"Streamline and optimize the sales process of your business by automating lead generation, qualification, and meeting scheduling. Summio leverages the power of AI to fill startup's sales pipeline with qualified leads, helping reduce costs by minimizing operational expenses. We are the one-stop platform for early and growth-stage startups seeking to scale their outbound and inbound sales efforts in an efficient and affordable way.",,2023-08-01,day,"Artificial Intelligence (AI), Enterprise Software, Internet, Sales Automation","Wilmington, Delaware, United States","Supercharge your sales with AI. Automate prospecting, qualifying, and meeting scheduling, so you can focus on closing deals.","370,886",,,,,,,,,,https://summio.co/,"Greater Philadelphia Area, East Coast, Southern US",,https://twitter.com/SummioAI,https://www.facebook.com/SummioAI,https://www.linkedin.com/company/summio/,,,,,,2,1-10,"Lalit Mohan Chawla, Rodrigo Lobera"
HALO HALO MEDIA LLC.,https://www.crunchbase.com/organization/halo-halo-media-llc,,,Active,For Profit,,,,2023-05-31,day,"Artificial Intelligence (AI), Mobile Apps, Software","Royal Palm Beach, Florida, United States",Mobile App,"371,602",,,,,,,,,,http://www.halohaloapp.com,"Greater Miami Area, East Coast, Southern US",,https://twitter.com/HaloHaloHQ,https://www.facebook.com/profile.php?id=100094494759384,https://www.linkedin.com/company/halo-halo-media-ltd/,,,,,,,1-10,
