Rock and Root Kava lounge,https://www.crunchbase.com/organization/rock-and-root-kava-lounge,Active,For Profit,,"Rock and Root Kava Wellness Lounge: Where Vibes Flow and Roots Grow Unleash your inner islander and let your worries melt away at Rock and Root Kava Wellness Lounge. We're not just your average kava bar – we're a vibrant oasis where wellness meets excitement. Sip on potent kava elixirs or explore our world of curated botanical teas, all while enjoying a buzz of fun:     Brain Games Wednesdays: Put your smarts to the test with our hilarious AI Trivia nights. Laughter guaranteed!     Live House Music: Immerse yourself in the soul-soothing sounds of local musicians every weekend.     Cue Up the Fun: Challenge friends to a friendly game on our pool tables.     Catch the Game: Relax and cheer on your favorite team on our multiple TVs.     Comfy Couch & Chill: Unwind in our cozy lounge area perfect for connecting with friends.     Affordable Bliss: Dive into our affordable menu of kava blends, teas, and delicious snacks. At Rock and Root, it's all about balance. We offer an escape from the ordinary, a place to rejuvenate your spirit, ignite your social spark, and discover the serenity of natural wellness. Come rock your worries, root your joy, and discover your happy place at Rock and Root Kava Wellness Lounge.",,2024-01-10,day,Food and Beverage,"Edgewater, Florida, United States","Root your well-being, one kava shell at a time. Rock & Root awaits","453,652",,,,,,,,,
ProductWise Middle East,https://www.crunchbase.com/organization/productwise-middle-east,Active,For Profit,,"ProductWise Middle East is a product consulting powerhouse based in Dubai working across the region with Founders, VCs, and Startups or companies who want to transform their digital products. ProductWise ME has the vision and ambition to establish MENA as the premier global hub for product innovation.  ProductWise ME Offers four service verticals:  Fractional CPO & and VP of Product (part-time product leadership).  Advisory & Product Audits (""product health"" check).  Coaching, Training & Workshops.  And, Product Events.",,2024-01-01,month,"Information Technology, Internet, Product Management, Software","Dubai, Dubai, United Arab Emirates","We are a product powerhouse consulting based in Dubai, working across the MENA region with Founders, VCs, and Startups.","456,918",,,,,,,,,
Diploi,https://www.crunchbase.com/organization/diploi,Active,For Profit,,,,2024-01-15,day,"Cloud Management, Developer Tools, Information Technology, PaaS","Helsinki, Southern Finland, Finland","Single SaaS service for managing, developing and hosting your full application.","457,038",,,,,,,,,
AntGames,https://www.crunchbase.com/organization/antgames,Active,For Profit,,"Play free games now at AntGames with all the best and latest game genres created and built by Interdog Media Pte. Ltd. We synthesize all the most convenient and unique features and bring you an enjoyable experience on AntGames' official homepage. Players can simultaneously play 1-player games, 2-player games, and multiplayer games on all available platforms, such as computers, phones, and tablets. Same browsers with different operating systems: iOS, Android, Windows. Let's explore games on AntGames without downloading.",,2024-01-21,day,"Gaming, Online Games","Singapore, Central Region, Singapore",AntGames has various free online Games for all ages to play in solo mode or 2-player mode with friends worldwide,"457,785",,,,,,,,,
Flavorish,https://www.crunchbase.com/organization/flavorish,Active,For Profit,,"From endless online recipe searches to last minute grocery runs, Flavorish simplifies all things cooking. Accessible anywhere, Flavorish does the thinking for you, creating a recipe using AI, smartly organizing grocery needs and simplifying recipe storage.",,2023-12-01,day,,"Toronto, Ontario, Canada","SaaS, AI powered recipe app","461,539",,,,,,,,,
Plusfinity,https://www.crunchbase.com/organization/plusfinity,Active,For Profit,,,,2023-12-02,day,Education,"New York, New York, United States",Mobile App,"464,865",,,,,,,,,
AB Wizard,https://www.crunchbase.com/organization/ab-wizard,Active,For Profit,,"AB Wizard is an AI-powered a/b testing software for digital advertising. It allows marketers to simplify their a/b testing software so they can accelerate results.  Get all of your ad tests in one place, so you can stop wasting time, get clear results, and drive more conversions.",,2024-01-12,day,"A/B Testing, Digital Marketing, Software","Atlanta, Georgia, United States",AB Wizard is an AI-powered a/b testing software for digital advertising.,"465,276",,,,,,,,,
Distopai,https://www.crunchbase.com/organization/distopai,Active,For Profit,,"DistopAI.com reflects a thoughtfully curated roster of AI-based tools and technological forerunners designed to assist, augment, and actualize the tech potential of businesses across the globe. We are an online directory with an inventive vision— to inspire, engage, and educate, all under one digital roof. Born out of a commitment to information accessibility and tech-driven evolution, DistopAI's inception came into being to empower both enterprises and individuals, newbies and tech aficionados alike, via unparalleled insight into the expansive world of Artificial Intelligence. As a catalyst to technological transformation, DistopAI is an enthusiast’s delight and a researcher's trusted library. We fuel ambitions, bolster innovation, and shape business strategies by delivering cutting edge-AI-resources to the hands that sculpt the technology-centric societies of tomorrow. Whether you're a startup navigating the complexity of the digital landscape, an established organization seeking technological advancement or an AI virtuoso on the lookout for the next powerful tool, DistopAI is your ultimate hub. We do more than just accumulating information – we streamline, analyze, and present it in a user-friendly format, making the pursuit of AI discovery simpler and more effective. Enriched with data and deep-dived research, our contents cover the myriad dimensions and applications of AI. Every tool, platform, and piece of tech-gear featured on our directory embraces unrivaled authenticity, ensuring utmost value for our users. The technology space is constantly evolving, and so is DistopAI. As we journey through the corridors of technological revolution, we learn, adapt, and grow, while envisaging a better confluence of humans and AI. DistopAI is not only about connecting you with AI tools but is committed to fostering a vibrant community, sparking conversations, and choreographing a symphony of ideas that resonate with the future. Join us as we venture on this technology-driven expedition, unearth AI treasures, and pave the path to a smart, technology-led future! DistopAI – Embrace AI. Create the Future.",,2024-01-10,day,,,Your Go-To Resource for Everything AI.,"467,719",,,,,,,,,
Pro Marketing Club,https://www.crunchbase.com/organization/wordwise-copywriting,Active,For Profit,,,,2023-12-01,day,"Advertising, Copywriting","Manchester, Manchester, United Kingdom",Content marketing help and advice,"469,168",,,,,,,,,
TrainYourWay.AI,https://www.crunchbase.com/organization/trainyourway-ai,Active,For Profit,,,,2024-01-01,month,"Fitness, Software","San Francisco, California, United States","Mobile App, SaaS, Personal Trainer Co-pilot","469,980",,,,,,,,,
Cashmere Charmers,https://www.crunchbase.com/organization/cashmere-charmers,Active,For Profit,,"Cashmere Charmers is a distinguished luxury brand synonymous with unparalleled craftsmanship, offering a captivating range of premium cashmere products. Rooted in the Himalayan craftsmanship of Nepal, our brand exemplifies the fusion of traditional artistry and modern elegance. We specialize in meticulously crafted cashmere scarves, beanies, and accessories, each embodying the essence of Nepalese heritage. At Cashmere Charmers, we take pride in sourcing the finest cashmere fibers, ensuring our products stand as a testament to quality, comfort, and style. Our commitment to sustainable practices echoes through our production processes, promoting ethical sourcing and environmental consciousness. As we embark on a journey to redefine luxury, Cashmere Charmers invites potential investors to join us in shaping the future of sustainable fashion. With a compelling vision and a legacy of excellence, we aspire to elevate the global perception of cashmere while fostering social responsibility. Invest in Cashmere Charmers—a brand that encapsulates the artistry of Nepal and the sophistication of luxury fashion. Together, let's weave a story of timeless elegance and sustainable luxury.",,2023-12-01,day,"E-Commerce, Retail, Sustainability, Textiles","Etah, Uttar Pradesh, India","Cashmere Charmers epitomizes luxury fashion, creating exquisite cashmere pieces that seamlessly blend style and comfort.","471,419",,,,,,,,,
WebDistrict021,https://www.crunchbase.com/organization/webdistrict021,Active,For Profit,,"WebDistrict021 is a market-leading IT Company that offers a wide range of digital services to startups, entrepreneurs, and enterprises.",,2023-12-01,day,"Advertising, Consulting, E-Commerce, Information Technology, Internet, Marketing, Professional Services, Software, Web Design, Web Development","Brooklyn, New York, United States",Web Design & Development Agency,"472,129",,,,,,,,,
Bee Telos,https://www.crunchbase.com/organization/bee-telos,Active,For Profit,,"In a market brimming with choices, Bee Telos shines as a distinctive leader. Our strength lies in an unwavering dedication to the enduring influence of face-to-face communication. Amid a landscape where technology often takes the spotlight, we champion the art of personal interaction, firmly believing that effective communication is the bedrock of success, a principle we embody in every aspect of our endeavors. Choosing Bee Telos as your partner goes beyond mere service selection; it signifies the embrace of a professional relationship like no other. Our commitment extends to delivering an unmatched level of professionalism and leveraging a network of invaluable connections in every market we engage. Recognizing that our clients seek representation reflecting their values and aspirations, we go beyond delivering results – we offer a representation that resonates.",,2023-12-01,month,"Consulting, Sales","Columbus, Ohio, United States",Bee Telos Inc. is a company devoted to developing human potential.,"473,331",,,,,,,,,
LiteoMED,https://www.crunchbase.com/organization/liteomed,Active,For Profit,,,,2024-02-15,day,"Generative AI, Health Care, Health Diagnostics","Bobigny, Ile-de-France, France","AI-Powered, Evidence-Based Clinical Decision Support System","474,152",,,,,,,,,
ENYRING GmbH,https://www.crunchbase.com/organization/enyring-gmbh,Active,For Profit,,,,2023-12-01,month,,"Berlin, Berlin, Germany",Battery subscription service company,"478,425",,,,,,,,,
Ncwallet NG/Africa,https://www.crunchbase.com/organization/ncwallet-ng-africa,Active,For Profit,,"Ncwallet offers a comprehensive suite of financial solutions for businesses, enabling direct customer payments through virtual accounts, along with versatile bill payment options. Our platform extends to providing virtual USD cards, allowing seamless transactions. In addition, Ncwallet Africa provides a robust RESTful API for virtual accounts, cards, bank transfers, and various bill payments such as airtime, internet data bundles, cable TV, electricity bills, education payments, and more. Utilizing the Ncwallet API empowers businesses to create and automate their platforms effectively.",,2024-01-07,day,,"Ibadan, Oyo, Nigeria",Ncwallet allows your customers to pay you directly. Get USD Virtual Card and Make Bill Payments.,"478,659",,,,,,,,,
PulsePurple,https://www.crunchbase.com/organization/pulsepurple,Active,For Profit,,Content and Affiliate Marketing,,2023-12-05,day,Marketing,"San Francisco, California, United States",Informational Website,"478,771",,,,,,,,,
iDomainSearch,https://www.crunchbase.com/organization/idomainsearch,Active,For Profit,,"Generate thousands of amazing domain names such as facebook, github, 1800flowers and more. With many ways to customize and filter your search results, Advanced Options helps you find the perfect domain name every time.",,2024-01-01,day,"Internet, Search Engine, Software, Web Hosting",,iDomainSearch helps you find short and memorable domain names in seconds.,"479,815",,,,,,,,,
KPI Creatives,https://www.crunchbase.com/organization/kpi-creatives,Active,For Profit,,,,2024-01-24,day,,,Content creation by subscription,"481,236",,,,,,,,,
Cosmefrica,https://www.crunchbase.com/organization/cosmetika,Active,For Profit,,"Cosmefrica brings the essence of African beauty to your doorstep! Our online store offers an exclusive range of natural skincare, haircare, and makeup products that celebrate Africa's rich traditions and ingredients. From the shea butter of Ghana to Morocco's argan oil, we connect you to the continent's healing and nourishing secrets. Enjoy instant cashback, free shipping on orders over R850, and support African entrepreneurs with every purchase. Join us and embrace a beauty experience where heritage meets luxury. Elevate your beauty routine with Cosmefrica – because you deserve the very best!",,2023-12-01,day,"Cosmetics, E-Commerce",,Shop African Cosmetics Brands in One Place,"482,845",,,,,,,,,
Filegaroo,https://www.crunchbase.com/organization/filegaroo,Active,For Profit,,"Filegaroo is a Telegram bot offering organized storage for files, messages, and notes. Filegaroo has an interface that simplifies data management, allowing sorting and access to digital content. It also enhances the Telegram experience with added security and convenience.",,2024-01-01,month,Software,"Novi Sad, Vojvodina, Serbia","Filegaroo is a Telegram bot offering organized storage for files, messages, and notes.","484,037",,,,,,,,,
Digital Actors,https://www.crunchbase.com/organization/digital-actors,Active,For Profit,,Digital Actors is a SaaS that specializes in creating AI-powered virtual characters. GenAI tools for 3D content creation,,2024-01-03,day,"Artificial Intelligence (AI), SaaS, Software","Santa Monica, California, United States",Digital Actors is a SaaS that specializes in creating AI-powered virtual characters.,"486,270",,,,,,,,,
NOMA,https://www.crunchbase.com/organization/noma-36d4,Active,For Profit,,,,2024-02-12,day,"Hospitality, Marketplace, Rental Property, Travel, Travel Accommodations",,NOMA is a technology company that enables remote workers and digital nomads to work & live comfortably anywhere.,"489,918",,,,,,,,,
FamHub,https://www.crunchbase.com/organization/famhub,Active,For Profit,,"Famhub is the most simple app to help your family closer, no matter how far you are. No matter the distance, cities, states, or continents, with Famhub, the whole family is in the same place.",,2023-12-15,day,"Family, Mobile Apps",,"Famhub is the most simple app to help your family closer, no matter how far you are.","490,034",,,,,,,,,
Muziki,https://www.crunchbase.com/organization/muziki,Active,For Profit,,Muziki is a Free Online Music Streaming Service that allows you to create your own playlists and listen to your favorite music.,,2024-01-01,day,"Internet Radio, Music, Music Streaming",,Music Streaming Website,"490,439",,,,,,,,,
smart data AI,https://www.crunchbase.com/organization/smart-data-ai,Active,For Profit,,We want to democratize law by providing AI lawyer for all legal stakeholders. Based on our super-intelligent legal language model we enable lawyers and clients easy access to law. Our approach is operating a platform in a vertical software 2.0 modell connecting clients with lawyers and provide lawyers with useful AI tools.,,2024-02-08,day,"Artificial Intelligence (AI), Legal, Legal Tech","Hamburg, Hamburg, Germany",With our legal language model we enable lawyers and clients easy access to law.,"491,262",,,,,,,,,
Q2Q Technologies,https://www.crunchbase.com/organization/q2q-technologies,Active,For Profit,,"Q2Q Technologies is a dynamic and innovative software development company specializing in the entertainment technology sector. At its core, Q2Q's mission is to provide exceptional, creative, and expeditious development services, with a keen focus on 3D technologies, database architecture, and maintenance. Their expertise lies in delivering significantly faster development cycles, ensuring measurable results, and offering a full suite of services that cater to the ever-evolving demands of the entertainment industry. The company's commitment to quality is evident in its approach to software development. Each project undertaken by Q2Q Technologies is guided by a set of core values: high quality, meticulous attention to detail, and the delivery of thoroughly tested results to minimize the need for bug fixes. This approach ensures reliability and efficiency in all their services. Additionally, Q2Q prides itself on its transparent and honest pricing strategy, eliminating the worry of hidden fees for its clients. Q2Q's long-term vision is to become a leading provider of software and development services across various disciplines within the entertainment technology sector, ranging from audio and lighting to video and more. This vision is supported by its sub-brands: TSMGO (The Show Must Go On), AnyMesh, StageSync, and Crescit, each contributing uniquely to the company's overall mission. TSMGO focuses on providing a secure, robust server backbone essential for powering mission-critical servers in entertainment technology. AnyMesh offers a diverse database of items across the entertainment industry, facilitating unparalleled collaboration. StageSync, serving as the user-facing arm, provides subscription services and software that access directories hosted by AnyMesh, ensuring seamless project synchronization across different platforms. Lastly, Crescit specializes in custom software development for a range of clients, highlighting Q2Q's capability to simplify complex systems while ensuring functionality. In summary, Q2Q Technologies stands as a beacon of innovation and excellence in the entertainment technology landscape, dedicated to revolutionizing the industry with its cutting-edge solutions, unwavering commitment to quality, and a forward-thinking approach to technology and development.",,2024-01-10,day,"Consulting, Digital Media, Events, Information Technology, Media and Entertainment, Software, Theatre",,"Software Development, App Development, Web Development, SaaS, Database Architecture","492,898",,,,,,,,,
Woofieprint,https://www.crunchbase.com/organization/woofieprint,Active,For Profit,,"Woofieprint are committed to providing you with a wide range of high-quality print on demand products like t-shirt, hoodie, sweatshirt, long sleeve, poster, canvas, blanket… at the most affordable prices. Our focus is on delivering exceptional service to our valued customers. Our online store was created with the sole purpose of providing a unique and enjoyable shopping experience for all our customers. Our promise to you is that we will do everything in our power to make things right if you ever encounter any issues with your order. We value your business and aim to treat you like family. Our mission is to help you find the perfect personalized gifts that will make every occasion extra special and memorable. We take pride in being a part of making someone’s day more special whenever they receive a unique gift made just for them. Customer satisfaction is our top priority, and we are confident that you will receive high-quality products and the best customer service. We want to build a lasting relationship with you and be there to celebrate all your milestones. Our fulfillment partner, Printify, is a print-on-demand (POD) fulfillment system that provides diversified products in the US for all e-commerce platforms. Products are printed and shipped in the US with an average production time of 1-5 business days with high quality. With a network of printers covering the entire United States, we can optimize the fastest shipping time for you. Thank you for choosing Woofieprint! Contact Us We’re here to help. For more information or assistance: Email     : support@woofieprint.com Website: https://woofieprint.com/ Warehouse & Mailing Address: 11410 Century Oaks Terrace #106, Austin, TX 78758, United States Thank you for choosing Woofieprint. Happy shopping! Hastag: #woofieprint",,2024-01-01,year,"E-Commerce, Retail","Austin, Texas, United States",Woofieprint - Clothings That Unleashes Your Inner Fashionista,"495,093",,,,,,,,,
Syntofy,https://www.crunchbase.com/organization/syntofy-e41a,Active,For Profit,,Heal by earn,,2023-12-08,day,"Blockchain, Cryptocurrency, SaaS, Software, Web3",,Saas & BaaS,"495,503",,,,,,,,,
QDOS Mintfinity,https://www.crunchbase.com/organization/mintfinity,Active,For Profit,,Mintfinity makes every product unique by giving it a label that lets customers take digital ownership of the item.,,2024-01-02,day,"E-Commerce, Internet, Marketing, Payments, Recycling","Southsea, Hampshire, United Kingdom",Services to the owners of digitally unique products,"496,283",,,,,,,,,
Cosito,https://www.crunchbase.com/organization/cosito,Active,For Profit,,Create sensor-based solutions for countless applications thought low-cost sensors and an AI-powered app,,2024-01-05,day,,,"SaaS, Mobile App, Internet of things, Artificial Intelligence","496,454",,,,,,,,,
Crown Fund,https://www.crunchbase.com/organization/crown-fund-08ce,Active,For Profit,,"Welcome to our seasoned team of investment professionals, well-versed in the intricacies of the late-stage investment landscape. Our strategy centers on pinpointing companies with robust growth potential, a competitive edge in their industry, and a skilled management team. Our fund extends accredited investors the opportunity to partake in late-stage investments, typically exclusive to institutional investors or high net worth individuals. Through our fund, you gain exposure to a diversified portfolio of late-stage companies.",,2024-01-25,day,,"New York, New York, United States","Crown Fund specializes in private equity, with a strategic focus on late-stage companies. Located in New York, NY.","500,744",,,,,,,,,
PayList,https://www.crunchbase.com/organization/paylist,Active,For Profit,,,,2024-01-01,year,"CRM, FinTech, Personal Finance","Bangkok, Krung Thep, Thailand",Your financial companion,"502,076",,,,,,,,,
Chunguza,https://www.crunchbase.com/organization/chunguza,Active,For Profit,,"An online travel website from which people can purchase flight tickets, book hotels and access other travel products online. We primarily serve people from Kenya, Tanzania and Uganda.",,2023-12-01,day,"E-Commerce Platforms, Travel",,Online Travel Booking Website,"502,936",,,,,,,,,
TS Biz Info,https://www.crunchbase.com/organization/ts-biz-info,Active,For Profit,,"In today's digital landscape, having a strong online presence is no longer optional - it's essential for business success. At TS Biz Info, we understand this challenge and are dedicated to helping businesses of all sizes thrive in the online world. We're more than just a business listing platform; we're your one-stop shop for online visibility and engagement. We offer a comprehensive suite of services designed to help you. We provide you a platform to list your business ensuring that you're easily discoverable by potential customers. Our SEO experts will optimize your website and online content to rank higher in search results, attracting more organic traffic. We offer a range of media publication and branding services to help you build brand awareness, establish trust, and generate leads. We are here to market your business online, because as rightly said “Ignoring online marketing is like opening a business but not telling anyone.” and who wants that? That is why we are here to help you through every step in the growth of your business. We offer different pricing plans to suit your budget so you don’t stay behind the competition.",,2023-12-22,day,"Advertising, Marketing","Noida, Uttar Pradesh, India","Advertising, Marketing, Business Listing","504,754",,,,,,,,,
Arloa Inc,https://www.crunchbase.com/organization/arloa,Active,For Profit,,"Arloa is an AI co-pilot to help parents of special needs children navigate getting services from their school, county assistance, and their rights under IDEA.",,2024-01-31,day,Health Care,,Arloa provides an AI co-pilot to parents who have a special needs child / children.,"506,645",,,,,,,,,
Darklyers,https://www.crunchbase.com/organization/darklyers,Active,For Profit,,"Darklyers is a technology company in Bangladesh focusing on AI, Computer Software, Mobile Application, e-commerce, Consumer electronics. Darklyers was founded on September 1, 2022 by Yeasin Ahmed and Umair Khondokar.",,2024-01-10,day,Information Technology,,"Darklyers is a technology company in Bangladesh focusing on AI, Computer Software, Mobile Application, e-commerce, Consumer electronics.","506,704",,,,,,,,,
Zunou AI,https://www.crunchbase.com/organization/zunou-ai,Active,For Profit,,,,2023-11-30,day,,,"SaaS, GenAI, Productivity","510,227",,,,,,,,,
streamr.ai,https://www.crunchbase.com/organization/streamr-ai,Active,For Profit,,,,2023-11-29,day,Software,,AI CTV Ad Manager,"511,691",,,,,,,,,
