Times of Kashi,https://www.crunchbase.com/organization/times-of-kashi,Active,For Profit,,"About Times of Kashi ""Times of Kashi"" is a digital media company based in the historic city of Varanasi (Kashi), India. Founded and led by Pradum Shukla , the company focuses on delivering news and information relevant to the local community as well as broader national and international audiences. With a blend of traditional journalism and modern digital strategies, ""Times of Kashi"" aims to provide accurate, timely, and engaging content across various platforms, catering to the diverse interests of its readership. Our Mission At Times of Kashi, our mission is simple yet profound: to empower our readers with knowledge. We strive to uphold the highest standards of journalism, providing accurate, balanced, and objective reporting that informs, educates, and engages our audience. Through our dedication to journalistic integrity and ethical practices, we aim to foster a well-informed community and contribute positively to the discourse in Kashi and its surroundings. What We Offer Whether you're seeking updates on politics, business, culture, sports, or technology, Times of Kashi has you covered. Our team of experienced journalists and editors work tirelessly to deliver news stories, features, analyses, and opinion pieces that resonate with our diverse readership. From breaking news alerts to in-depth investigative reports, we strive to deliver content that reflects the pulse of Kashi and reflects the values of our community. Our Commitment to Excellence At Times of Kashi, excellence is not just a goal; it's a commitment. We are committed to upholding the highest standards of journalism, adhering to principles of accuracy, fairness, and transparency in all our reporting. Our dedication to excellence extends beyond the newsroom to our interactions with our readers, partners, and stakeholders. We welcome feedback, suggestions, and constructive criticism as we continuously strive to improve and evolve. Join Us We invite you to join us on this journey of discovery, exploration, and enlightenment. Whether you're a lifelong resident of Kashi, a newcomer to the city, or simply curious about the world around you, Times of Kashi is your gateway to informed discourse and meaningful engagement. Stay connected with us through our website, social media channels, and newsletters to stay informed, inspired, and empowered. Thank you for choosing Times of Kashi as your trusted source for news and information. Together, let's navigate the currents of change and chart a course towards a brighter, more informed future.",,2024-02-10,day,,"Varanasi, Uttar Pradesh, India","""Times of Kashi"" is a digital media company based in the historic city of Varanasi (Kashi), India Founded and led by Pradum Shukla (PRXDUM).","1,202,358",,,,,,,,,
Everwell,https://www.crunchbase.com/organization/everwell,Active,For Profit,,,,2024-01-27,day,Personal Health,"Minneapolis, Minnesota, United States",We're helping people living with chronic conditions by providing a new kind of health tracking toolkit.,"1,207,429",,,,,,,,,
Indie Courses,https://www.crunchbase.com/organization/indie-courses,Active,For Profit,,"Creating a video course is hard, but selling it is even harder—until now. Indie Courses helps you sell your course quickly and gives you the tools and knowledge to make more sales than you would elsewhere. No marketing degree needed.",,2024-01-02,day,"E-Learning, EdTech, Education","Newark, Delaware, United States",The video course platform for indie creators,"1,208,063",,,,,,,,,
HM Digital Solution,https://www.crunchbase.com/organization/hm-digital-solution,Active,For Profit,,"Welcome to HM Digital Marketing, where innovation meets impact! We are a dynamic and results-driven digital marketing agency committed to propelling your business to new heights in the digital realm. With a passion for creativity and a keen understanding of the ever-evolving online landscape, we specialize in crafting tailored strategies that resonate with your target audience and drive measurable success. Our team of seasoned digital marketing experts is dedicated to harnessing the power of the latest technologies and trends to elevate your brand presence.",,2023-12-01,day,"Business Development, Digital Marketing, Marketing, Reputation","Dhaka, Dhaka, Bangladesh",Top Rated Digital Marketing Agency,"1,222,113",,,,,,,,,
Smooth Marketers,https://www.crunchbase.com/organization/smooth-marketers,Active,For Profit,,,,2024-01-01,day,,,Digital Marketing Agency for Businesses,"1,224,105",,,,,,,,,
TraceChain,https://www.crunchbase.com/organization/tracechain-1f19,Active,For Profit,,Building AI and ML driven L4 and L5 traceability software solutions for regulated industries,,2023-12-01,month,Supply Chain Management,"South Pasadena, California, United States",Building L4 and L5 traceability software solutions for regulated industries,"1,235,662",,,,,,,,,
Little Nightmares APK,https://www.crunchbase.com/organization/little-nightmares-apk,Active,For Profit,,"Welcome To The Official Little Nightmares APK Website, Now Unlock a captivating horror-adventure game. Set in the ominous world of The Maw, players guide Six, a small, vulnerable character, through dark and atmospheric environments. Focused on stealth and puzzles, the game creates an immersive, spine-chilling experience with its unique art style and eerie narrative. So, Use the Link for Little Nightmares APK Download Free Mod Full Unlocked.",,2024-02-03,day,,,"The Official Little Nightmares APK Website, Now Unlock a captivating horror-adventure game.","1,240,948",,,,,,,,,
Maokoto Africa Tours and Safaris,https://www.crunchbase.com/organization/maokoto-africa-tours-and-safaris,Active,For Profit,,"Maokoto Africa Tours and Safaris, based in Arusha, Tanzania, is a collaborative venture of experienced tour operators dedicated to delivering unparalleled experiences across Tanzania, Kenya, Uganda, and Rwanda. We specialize in diverse tour packages, ranging from budget-friendly options to luxurious safari experiences. Our commitment to excellence is reflected in our tailor-made itineraries, ensuring each client enjoys a personalized and unforgettable journey with us. Choose Maokoto for an exceptional blend of expertise, flexibility, and a passion for crafting unique travel adventures.",,2023-12-23,day,Tour Operator,"Arusha, Arusha, Tanzania","Tour Operator in East Africa (Tanzania, Kenya, Uganda, and Rwanda","1,242,117",,,,,,,,,
Wholetailer,https://www.crunchbase.com/organization/wholetailer,Active,For Profit,,Wholetailer is a company that has emerged to meet the needs of Indian's retail sector by empowering reatilers across the country and facilitating the offline exchange of goods between D2C brands and retailers,,2024-01-01,year,Wholesale,"Gurgaon, Haryana, India",Wholesale Platform,"1,245,953",,,,,,,,,
Virality Labs,https://www.crunchbase.com/organization/virality-labs,Active,For Profit,,"""At Virality Labs, we don't just deliver jaw-dropping videos; we ignite a viral revolution. Each frame propels followers into a journey where engagement transforms into paying customers.""",,2023-12-01,day,Video Editing,,Video Editing Agency,"1,255,497",,,,,,,,,
Conversioncult,https://www.crunchbase.com/organization/conversioncult,Active,For Profit,,"We Empower D2C brands to transform clicks into lifelong customers through High-converting Ads, Landing Pages, Funnels, WhatsApp Marketing and Conversion Optimization.",,2023-12-18,day,Service Industry,,"Conversioncult utilizes high-converting ads, landing pages, funnels, WhatsApp marketing, and conversion optimization.","1,260,994",,,,,,,,,
IRON GRIP ARMY LLC,https://www.crunchbase.com/organization/iron-grip-army-llc,Active,For Profit,,Iron Grip Army is a grip strength business that sells grip strength equipment and offers grip strength training and grip strength education.,,2024-01-12,day,Fitness,,Grip Strength Training And Equipment,"1,262,847",,,,,,,,,
Just Heard,https://www.crunchbase.com/organization/just-heard,Active,For Profit,,"Your gateway to the latest, hottest, and most viral news. Dive into captivating stories, breaking news, and trending topics that resonate with the pulse of today. Stay informed, entertained, and ahead of the curve with our engaging curation of fresh, firsthand news delivered straight to your screens.",,2024-01-07,day,News,,"Latest, Hottest, and Viral News","1,267,747",,,,,,,,,
Mentor's Lounge University,https://www.crunchbase.com/organization/mentor-s-lounge-university,Active,For Profit,,"It is a premier platform connecting individuals with influential Mentors of African descent for personalized, one-on-one mentorship sessions. Our app is designed to democratize success by bringing together successful individuals, experts, and mentors with those seeking guidance, creating a vibrant community of shared knowledge and empowerment for Africans irrespective of their location. MLU offers users the unique chance to delve into insightful short courses, seamlessly blending mentorship with curated education.",,2023-12-06,day,"EdTech, Education, Training, Video Chat","Abeokuta, Ogun, Nigeria","A premium platform that connects individuals with Mentors for personalized, 1-on-1 sessions.","1,270,715",,,,,,,,,
Thepanel,https://www.crunchbase.com/organization/evgenii,Active,For Profit,,"Thepanel is a dynamic, open-source Mixpanel alternative analytics platform for web and mobile applications.",,2023-12-01,day,"Analytics, Open Source, SaaS",,Open-Source Mixpanel alternative,"1,273,931",,,,,,,,,
Smarthink AI,https://www.crunchbase.com/organization/smarthink-ai,Active,For Profit,,,,2023-12-14,day,Artificial Intelligence (AI),,Artificial Intelligence Company,"1,282,270",,,,,,,,,
CAAVER,https://www.crunchbase.com/organization/caaver,Active,For Profit,,"Embarking on the journey to establish a thriving business? Whether in e-commerce, marketing websites, or mobile applications. We are dedicated to assisting businesses in reaching their ultimate objectives by crafting exceptional online experiences and solutions.",,2024-02-02,day,Information Technology,"Fès, Fes-Boulemane, Morocco",Web and Mobile applications development,"1,289,147",,,,,,,,,
Robomap,https://www.crunchbase.com/organization/robomap,Active,For Profit,,,,2024-02-04,day,Information Technology,"Barcelona, Catalonia, Spain",Full-Stack Solution for the Industry,"1,291,304",,,,,,,,,
Astylab Ventures,https://www.crunchbase.com/organization/astylab-ventures,Active,For Profit,,,,2023-12-19,day,"Angel Investment, Impact Investing",,Investing in the Future of Urban Living,"1,299,870",,,,,,,,,
Thirdi,https://www.crunchbase.com/organization/thirdi,Active,For Profit,,"Thirdi is an AI-powered platform designed to help marketers and agencies improve digital campaign performance across channels and generate actionable insights from their marketing data. Our AI-powered platform unifies your data from every platform, turning it into clear, actionable insights you can understand and use.",,2024-01-29,day,"Artificial Intelligence (AI), Digital Marketing, SaaS, Software","Singapore, Central Region, Singapore",Thirdi is an AI-powered platform that improves digital campaign performance by generating actionable insights from marketing data.,"1,303,222",,,,,,,,,
Alfezo,https://www.crunchbase.com/organization/alfezo,Active,For Profit,,"Alfezo is a full-stack WhatsApp Marketing Service agency. It helps businesses to adopt WhatsApp as their marketing channel using tools, innovative and ROI-driven marketing strategy on WhatsApp.",,2023-12-01,day,"Brand Marketing, Information Technology, Marketing Automation",,Alfezo is a WhatsApp Marketing agency. Unlock the power of personalized and engaging WhatsApp campaigns to reach your target audience.,"1,307,248",,,,,,,,,
Blumefy Technologies,https://www.crunchbase.com/organization/blumefy-technologies,Active,For Profit,,,,2023-12-12,day,,,Global Financial services for Africans,"1,307,682",,,,,,,,,
Inform Data Solutions,https://www.crunchbase.com/organization/inform-data-solutions,Active,For Profit,,"Lead by Calvron Wachter, Inform Data Solutions is a team of veteran data strategists that have worked in rapidly growing healthcare companies.  We have developed a playbook for emerging companies with aspirations for immediate and lasting growth. By providing a full range of services to help your company grow, our team will allow your leadership team to focus on your company's direction and operations.",,2024-01-01,day,,"Springfield, Tennessee, United States",Strategy & Market Intelligence - Targeting & Recruiting - Scalability & Communication,"1,313,764",,,,,,,,,
Golancer,https://www.crunchbase.com/organization/golancer,Active,For Profit,,,,2024-01-01,day,"Advertising Platforms, Freelance, Human Resources, Marketplace, Outsourcing","Lagos, Lagos, Nigeria",Global freelancing marketplace for African tech and creative talents,"1,313,925",,,,,,,,,
Market Blizz,https://www.crunchbase.com/organization/market-blizz,Active,For Profit,,"A hybrid marketing agency that provides social media marketing, SEO, content marketing, paid marketing, branding, and advertising services. The team of over 10+ specializes in social media marketing, advertising, web designing, graphics designing, and email marketing for its small-to-medium-sized clients.",,2023-12-20,day,"Advertising, Creative Agency, Digital Marketing, Email Marketing, Marketing, Social Media, Social Media Marketing, Web Design, Web Development","Lahore, Punjab, Pakistan",Market Blizz is hybrid marketing agency that provides all type of marketing and advertising services around the globe.,"1,318,182",,,,,,,,,
Agent ASAP,https://www.crunchbase.com/organization/agent-asap,Active,For Profit,,"Agent ASAP: Revolutionizing Real Estate Connections in Canada Founded in 2024, Agent ASAP has quickly established itself as a pioneering force in the Canadian real estate sector, dedicated to transforming how buyers, sellers, and real estate agents connect and transact. Headquartered in Calgary, Alberta, our mission is to streamline the real estate journey, making it more transparent, efficient, and satisfying for all parties involved. Innovative Platform Bridging Gaps At the core of Agent ASAP is an innovative digital platform designed with the user experience in mind. Recognizing the challenges faced by individuals in the real estate market—ranging from the daunting task of finding the right agent to ensuring a smooth transaction process—Agent ASAP leverages technology to provide solutions that are both intuitive and impactful. For Buyers and Sellers: A Path to Success Buyers and sellers using Agent ASAP benefit from a curated experience that respects their unique needs and preferences. For buyers, this means access to a selection of properties that align with their desires and budget, backed by agents who are not just representatives, but advisors. Sellers, on the other hand, are matched with agents skilled in market analysis, strategic pricing, and innovative marketing strategies, ensuring their property stands out and sells for the best possible price. Core Values and Commitment Transparency, innovation, customer-centricity, and integrity are the pillars upon which Agent ASAP is built. We operate with a steadfast commitment to these values, ensuring every interaction and transaction on our platform upholds the highest standards of honesty, quality, and client satisfaction. Transparency: We advocate for clear communication and openness in all our dealings, ensuring clients and agents alike are fully informed and confident in their decisions. Innovation: Agent ASAP is at the forefront of adopting and developing new technologies to enhance the real estate experience, always looking for smarter ways to connect, communicate, and close deals. Customer-Centricity: Our platform and services are designed around the needs and goals of our users, ensuring personalized experiences that lead to successful real estate outcomes. Integrity: We maintain the highest ethical standards, vetting our agents rigorously and operating with honesty and respect in every aspect of our business. Join Us Whether you're a buyer, seller, or real estate agent, Agent ASAP invites you to experience a new standard in real estate. With Agent ASAP, your next move is not just a transaction, but a step toward achieving your dreams. Discover the difference today and see how we're making real estate better for everyone.",,2024-01-01,year,Real Estate,"Calgary, Alberta, Canada",Agent ASAP: Revolutionizing Canadian real estate with seamless connections between clients and top-quality agents for buying and selling.,"1,318,580",,,,,,,,,
DivaSilver,https://www.crunchbase.com/organization/divasilver,Active,For Profit,,"DivaSilver features unique & handmade jewelry, accessories, vintage collectables and nature inspired gifts.",,2023-12-15,day,Jewelry,"New Paltz, New York, United States",DivaSilver is a online platform dealing with sale of jeweleries.,"1,320,374",,,,,,,,,
AssistFlare,https://www.crunchbase.com/organization/assistflare,Active,For Profit,,"Upgrade your Notion docs to a dynamic, customer-focused hosted knowledge base - zero coding and zero design skills required. SEO built-in. Enable customers to easily find answers with your SEO-optimized knowledge base, reducing support interactions and building trust through comprehensive, accessible documentation.",,2023-12-01,day,"E-Commerce, Education, Information Technology, Internet, Software, Training, Web Design, Web Development",,"Upgrade your Notion docs to a dynamic, customer-focused hosted knowledge base - zero coding and zero design skills required. SEO built-in.","1,323,274",,,,,,,,,
MyHomeHub.co,https://www.crunchbase.com/organization/myhomehub-co,Active,For Profit,,"Home Hub is a service connecting homeowners with qualified, local professionals for a variety of home needs from repairs to maintenance services. They match customers with specialists based on the required service and provide profile information to select the best fit. Home Hub offers a streamlined way for homeowners to find trusted electricians, plumbers, painters, landscapers and other experts for any home project.",,2023-12-14,day,,,"Home Hub offers connections to local home service professionals including plumbers, painters, gardeners and more.","1,326,428",,,,,,,,,
Explyt,https://www.crunchbase.com/organization/explyt,Active,For Profit,,"Explyt is AI with new generation of tools helps developers to test, debug and vulnerabilities detection using our own SAST engine, symbolic execution and latest AI research. What Explyt can do: - Analyse and understand code  - Generate test with Maximized coverage - Minimize false positive - Cover 95% of the testing work - Reduce CI/CD cost for testing (test suite minimized) - Represent your vulnerability as test",,2024-01-26,day,"Artificial Intelligence (AI), Quality Assurance, Software","Hong Kong, Hong Kong Island, Hong Kong","Explyt is AI with new generation of tools for developers to test, debug and vulnerabilities detection using our SAST and symbolic execution","1,330,041",,,,,,,,,
EveOn Money,https://www.crunchbase.com/organization/eveon-money,Active,For Profit,,"EveOn Money is revolutionizing the loan landscape in India by connecting small loan brokers with trusted banks, leveraging AI-powered technology, and offering expert in-house loan assistance. We empower brokers, banks, and borrowers with a frictionless and efficient experience throughout the loan journey. Here's what sets us apart: Extensive Network: We connect brokers with 150+ branches across India, offering wider access to diverse loan options. AI-powered Platform: Our cutting-edge AI streamlines document recognition and analyzes pending payments, accelerating loan processing and improving accuracy. Dedicated Support: Our in-house loan specialists guide borrowers through the application process, ensuring seamless document processing and increased approval chances. Multi-bank Partnerships: We have established relationships with reputable banks, providing borrowers with competitive rates and terms. Benefits for Brokers: Expand your reach: Tap into a vast network of banks and reach more potential borrowers. Boost efficiency: Our AI platform simplifies tasks and saves you valuable time. Offer value-added services: Stand out with our advanced data analysis and loan processing expertise. Get paid faster: Receive commissions within a day of loan disbursal, boosting your cash flow. Real-time insights: Access real-time data on your loan portfolio and individual borrower payment statuses, enabling informed decision-making. Benefits for Banks: Acquire new customers: Access a wider pool of pre-qualified borrowers through our broker network. Reduce processing time: Our AI platform expedites loan applications and minimizes errors. Make informed decisions: Gain valuable insights from borrower data analysis. Benefits for Borrowers: Wider range of options: Compare loan offers from multiple banks to find the best fit. Simplified process: Our team assists you with every step, making the application process stress-free. Fast disbursals: Enjoy swift access to approved loan funds.",,2024-01-31,day,"Finance, Financial Services, FinTech",,"Financial Services, Fintech Brand","1,336,141",,,,,,,,,
Nubel,https://www.crunchbase.com/organization/nubel,Active,For Profit,,"Nubel is a cutting-edge platform that revolutionizes staffing agency operations. This innovative solution simplifies every facet of staffing agency management using advanced AI technology. From hiring and sales to HR and finance, Nubel consolidates these functions into one user-friendly platform, eliminating the need for multiple disjointed tools. This all-in-one approach enhances efficiency, allowing agencies to thrive while freeing their teams from repetitive tasks. Nubel's mission is to empower individuals to focus on meaningful work, transforming complexity into opportunity. Join us as we redefine staffing agency operations for the future.",,2023-12-01,month,,"Vancouver, British Columbia, Canada",The all-in-one solution for Staffing Agencies.,"1,353,122",,,,,,,,,
SynapSpark,https://www.crunchbase.com/organization/synapspark,Active,For Profit,,,,2023-12-01,day,"Artificial Intelligence (AI), Construction, Consulting, Real Estate","Tokyo, Tokyo, Japan",SynapSpark is a real estate company that creates sustainable value for buildings through social implementation using AI technology.,"1,353,973",,,,,,,,,
Qaum LLC,https://www.crunchbase.com/organization/qaum-llc,Active,For Profit,,,,2024-01-02,day,"EBooks, Education",,Education and research-related products and services,"1,368,250",,,,,,,,,
Yooba technology,https://www.crunchbase.com/organization/yooba-technology,Active,For Profit,,"Yooba Technology, a pioneering startup in the tech industry, is dedicated to transforming the landscape of e-commerce, data processing, and artificial intelligence. As the proud owner of Bricop.com, a dynamic home improvement marketplace, and Malvaro.com, a vibrant coffee marketplace, our firm combines innovation and expertise to create seamless and personalized online experiences. With a commitment to advancing technology, Yooba Technology is poised to redefine the future of digital commerce.",,2023-12-09,day,,,"Yooba Technology is a startup tech firm with a focus on e-commerce, data processing, and artificial intelligence.","1,377,150",,,,,,,,,
TuNuevoLook,https://www.crunchbase.com/organization/tunuevolook,Active,For Profit,,Get the cheapest and most stylish hairstyle recommendations right into your WhatsApp.,,2024-01-06,day,Software,"Ciudad Nezahualcóyotl, Mexico, Mexico",Yet another ai hairstyle generator,"1,377,640",,,,,,,,,
CigarsNCigars,https://www.crunchbase.com/organization/cigarsncigars,Active,For Profit,,"CigarsNCigars.com is a premier online destination for cigar enthusiasts, offering a vast selection of premium cigars from around the world. With a focus on quality, authenticity, and customer satisfaction, CigarsNCigars.com caters to both seasoned aficionados and newcomers to the world of cigars. Our platform provides a seamless shopping experience, featuring detailed product descriptions, expert recommendations, and competitive pricing. Whether you're seeking top-rated brands, limited editions, or budget-friendly options, CigarsNCigars.com has something for every taste and preference. Join us in celebrating the art and tradition of cigar smoking with our curated collection of fine cigars.",,2024-01-01,day,Wholesale,,Retail Store,"1,381,704",,,,,,,,,
InkWhirl Media Networks Private Limited,https://www.crunchbase.com/organization/inkwhirl-media-networks-private-limited,Active,For Profit,,Inkwhirl is a magazine company that was founded by Mrigendra Bharti and is operated by the Mrigendra Bharti Group. It is an international magazine company.,,2023-12-09,day,,,Magazine Company,"1,388,836",,,,,,,,,
Didekor Aja - Jasa Pembuatan Kitchen Set Cianjur & Bandung,https://www.crunchbase.com/organization/didekor-aja,Active,For Profit,,"Perusahaan yang berfokus pada jasa pembuatan kitchen set dan pembangunan. Saat ini dapat melayani beberapa kota besar di Jawa Barat dan Jakarta dan akan terus berkembang hingga ke seluruh Indonesia. Didirikan pada tahun 2023 oleh Cv. Orizin Ciptapedia, kami berkomitmen untuk selalu memberikan layanan yang memuaskan untuk para pelaggan kami. Kunjungi Situs website kami di https://dideoraja.com/ dan temukan kemudahan dalam memiliki furnitur kustom impian Anda. Area Layanan: Kitchen Set Bandung Kitchen Set Bogor Kitchen Set Cianjur Kitchen Set Sukabumi Kitchen Set Purwakarta Kitchen Set Bekasi Kitchen Set Jakarta Kitchen Set Depok Kitchen Set Cimahi",,2023-12-12,day,Furniture,"Cianjur, Jawa Barat, Indonesia","Jasa pembuatan kitchen set paling murah yang melayani beberapa kota besar di Jawa Barat dan Jakarta, dan akan terus berkembang.","1,390,417",,,,,,,,,
