Organization Name,Organization Name URL,SEMrush - Monthly Visits,Number of Contacts,Operating Status,Company Type,Last Funding Date,Full Description,Last Funding Type,Founded Date,Founded Date Precision,Industries,Headquarters Location,Description,CB Rank (Company),Last Funding Amount,Last Funding Amount Currency,Last Funding Amount Currency (in USD),Total Funding Amount,Total Funding Amount Currency,Total Funding Amount Currency (in USD),Number of Investors,Top 5 Investors,Number of Lead Investors,Website,Headquarters Regions,Estimated Revenue Range,Twitter,Facebook,LinkedIn,Number of Investments,Number of Lead Investments,Accelerator Program Type,Accelerator Application Deadline,Accelerator Duration (in weeks),Number of Founders,Number of Employees,Founders
Reken,https://www.crunchbase.com/organization/reken,,,Active,For Profit,2024-01-31,"Reken is an AI & cybersecurity firm building a new type of AI platform and products to protect against generative AI-enabled threats, including deepfake social engineering and automated fraud. The company was founded in 2024 and is based in San Francisco, California.",Seed,2024-01-01,day,"Artificial Intelligence (AI), Communications Infrastructure, Cyber Security, Fraud Detection, Information Technology, Machine Learning, Network Security, Security, Software","San Francisco, California, United States",Reken is an AI & cybersecurity firm building a new type of AI platform and products to protect against generative AI-enabled fraud.,167,10000000,USD,10000000,10000000,USD,10000000,10,"Fika Ventures, Jazz Venture Partners, Sequoia Scout, Greycroft, Firebolt Ventures",2,https://reken.ai,"San Francisco Bay Area, West Coast, Western US",,https://twitter.com/reken_ai,,https://www.linkedin.com/company/reken-ai/,,,,,,2,1-10,"Rich Griffiths, Shuman Ghosemajumder"
xAI,https://www.crunchbase.com/organization/xai,"157,493",1,Active,For Profit,2023-12-05,xAI is an AI company that seeks to understand the true nature of the universe. The company's goal is to be a useful tool for consumers and businesses and there is value in having multiple entities and competition.,Pre-Seed,2023-07-12,day,"Artificial Intelligence (AI), Generative AI, Information Technology, Machine Learning","Austin, Texas, United States",xAI is an AI company that seeks to understand the true nature of the universe.,395,134679312,USD,134679312,134679312,USD,134679312,1,Roman Smolevskiy,,https://x.ai,Southern US,$10M to $50M,https://twitter.com/xai,,https://www.linkedin.com/company/xaicompany,,,,,,,101-250,
Enkrypt AI,https://www.crunchbase.com/organization/enkrypt-ai,742,2,Active,For Profit,2024-02-27,Enabling faster and secure adoption of Gen AI models in Enterprises.,Seed,2023-03-31,day,"Artificial Intelligence (AI), Asset Management, Digital Marketing, Information Technology","Boston, Massachusetts, United States",Enabling faster and secure adoption of Gen AI models in Enterprises.,"3,302",2350000,USD,2350000,2350000,USD,2350000,6,"Berkeley SkyDeck Fund, Arka Venture Labs, Kubera Venture Capital, Veredas Partners, BoldCap",1,https://www.enkryptai.com,"Greater Boston Area, East Coast, New England",,,,https://www.linkedin.com/company/enkryptai/?viewAsMember=true,,,,,,,1-10,
DatologyAI,https://www.crunchbase.com/organization/datologyai,,,Active,For Profit,2024-02-22,"DatologyAI optimize training efficiency, maximize performance and reduce compute costs with expert curation.",Seed,2023-09-05,day,"Artificial Intelligence (AI), Information Technology","Redwood City, California, United States","DatologyAI optimize training efficiency, maximize performance and reduce compute costs.","3,789",11650000,USD,11650000,11650000,USD,11650000,16,"Douwe Kiela, Radical Ventures, Amplify Partners, Jeff Dean, Adam D’Angelo",1,https://www.datologyai.com/,"San Francisco Bay Area, Silicon Valley, West Coast",,https://twitter.com/datologyai,,https://www.linkedin.com/company/datologyai/about/,,,,,,2,1-10,"Ari Morcos, Bogdan Gaza"
Artisan AI,https://www.crunchbase.com/organization/artisan-ai,"6,981",1,Active,For Profit,2023-12-08,"Artisan AI creates digital workers, called Artisans. The company's first Artisan, Ava, automates the entire outbound sales process and can be set up with a 10-minute conversation. Ava creates TCPs, and prospects with her database of over 270,000,000 contacts, crafts and sends highly bespoke email sequences, and books meetings into the user's calendar. The user can manage all features and settings by talking to Ava via Slack.",Venture - Series Unknown,2023-09-14,day,"Artificial Intelligence (AI), Information Technology, Internet, SaaS, Software","San Francisco, California, United States","Artisan AI develops digital workers known as Artisans, with human-like attributes, to automate end-to-end job workflows.","4,471",,,,2300000,USD,2300000,4,"Y Combinator, Sequoia Scout, Oliver Jung, Bayhouse Capital",3,https://artisan-ai.com,"San Francisco Bay Area, West Coast, Western US",$1M to $10M,https://twitter.com/gerartisanai,,https://www.linkedin.com/company/artisanai,,,,,,2,11-50,"Jaspar Carmichael-Jack, Rupert Dodkins"
Ocular AI,https://www.crunchbase.com/organization/ocular-ai,,,Active,For Profit,2024-02-01,"Ocular is a Cloud and Artificial Intelligence company, backed by Y Combinator, bringing Enterprise AI and Search to the Workplace and Engineering.",Pre-Seed,2024-01-01,year,"Artificial Intelligence (AI), B2B, Cloud Infrastructure, Generative AI, Machine Learning, SaaS","San Francisco, California, United States",Enterprise AI and Search for the Workplace and Engineering.,"4,712",500000,USD,500000,500000,USD,500000,1,Y Combinator,1,https://www.useocular.com,"San Francisco Bay Area, West Coast, Western US",,,,https://www.linkedin.com/company/use-ocular,,,,,,2,1-10,"Louis Murerwa, Michael Moyo"
Optimizer AI,https://www.crunchbase.com/organization/optimizer-ai,,,Active,For Profit,2024-01-17,Optimizer AI creates AI technology to swiftly and simply generate resources required for game and content development.,Pre-Seed,2023-07-01,month,"Artificial Intelligence (AI), Information Technology, Software","San Francisco, California, United States",Optimizer AI creates AI technology to swiftly and simply generate resources required for game and content development.,"5,003",1000000000,KRW,742854,1000000000,KRW,742854,2,"Andreessen Horowitz, Krew Capital",2,https://www.optimizerai.xyz,"San Francisco Bay Area, West Coast, Western US",,,,,,,,,,,,
Rubix,https://www.crunchbase.com/organization/rubix-b1b8,,2,Active,For Profit,2023-11-21,,Pre-Seed,2023-06-29,day,"Artificial Intelligence (AI), Content Creators, SaaS, Software","Redmond, Washington, United States",AI creator platform that enables users to create their own AI and share.,"8,454",500000000,KRW,385754,500000000,KRW,385755,2,"Klim Ventures, Washington Technology Industry Association (WTIA)",2,https://joingobi.com,"Greater Seattle Area, West Coast, Western US",,,,https://www.linkedin.com/company/96347701,,,,,,2,1-10,"Hoon Moon, Minsuk Kang"
Factory,https://www.crunchbase.com/organization/factory-19d8,,,Active,For Profit,2023-11-02,,Seed,2023-04-01,month,"Artificial Intelligence (AI), Developer Tools, Software, Software Engineering","San Francisco, California, United States",The machine that builds the machine.,"8,702",5000000,USD,5000000,5000000,USD,5000000,4,"Sequoia Capital, Clément Delangue, Lux Capital, Ali Ghodsi",2,https://www.factory.ai/,"San Francisco Bay Area, West Coast, Western US",,https://twitter.com/factoryAI_,,,,,,,,2,1-10,"Eno Reyes, Matan Grinberg"
Wraithwatch,https://www.crunchbase.com/organization/wraithwatch,,,Active,For Profit,2023-11-02,Wraithwatch develops an AI-driven cybersecurity platform designed to anticipate and counter AI-powered cyberattacks through the use of large language models.,Seed,2023-10-01,month,"Artificial Intelligence (AI), Cyber Security, Software","Bozeman, Montana, United States",Wraithwatch is a developer of an AI-driven cybersecurity platform.,"8,730",8000000,USD,8000000,8000000,USD,8000000,3,"Founders Fund, Human Capital, XYZ Venture Capital",,https://www.wraithwatch.com,Western US,,https://twitter.com/wraithwatch,,https://www.linkedin.com/company/wraithwatch,,,,,,3,1-10,"Carlos Mas, Nik Seetharaman, Savannah Grace Clemente"
Griptape,https://www.crunchbase.com/organization/griptape,"6,992",16,Active,For Profit,2023-09-14,"Griptape is an enterprise-grade Python framework that helps developers harness LLMs' potential. The company is based on an open source modular Python framework for LLM workflows, tools, memory, and data that empowers developers to build AI agents, sequential LLM pipelines, and sprawling DAG workflows with strict security and reliability measures.",Seed,2023-05-01,month,"Artificial Intelligence (AI), Data Integration, Enterprise Software, Internet, Machine Learning","Seattle, Washington, United States",Griptape is an enterprise-grade Python framework that helps developers harness LLMs' potential.,"8,859",12544141,USD,12544141,14594141,USD,14594141,4,"Peterson Ventures, Acequia Capital (AceCap), Range Ventures, Service Provider Capital",2,https://www.griptape.ai/,"Greater Seattle Area, West Coast, Western US",$1M to $10M,,,https://www.linkedin.com/company/griptape-ai/,,,,,,2,11-50,"Kyle Roche, Vasily Vasinov"
"Layer AI, Inc",https://www.crunchbase.com/organization/layer-e061,"32,667",,Active,For Profit,2023-11-16,"Layer is the number one productivity tool for gaming creators. Whether creating solo or working in a team, creators of any skill level can train the AI using their own art work and create infinite new variations. Layer allows gaming creators ship games faster overall and run them more effectively by shipping monetization and marketing art more effectively. Layer currently serves 100s of gaming creators of any sizes globally.",Seed,2023-07-01,month,"Art, Artificial Intelligence (AI), Casual Games, Machine Learning, Software, Video Games","San Francisco, California, United States",Layer AI is the number one productivity tool for professional game art creation serving game creators and publishers of all sizes globally.,"8,894",1800000,USD,1800000,1800000,USD,1800000,12,"GFR Fund, 500 Emerging Europe, The Games Fund, Akin Babayigit, Laton Ventures",,https://layer.ai/,"San Francisco Bay Area, West Coast, Western US",,https://twitter.com/layer_ai,,https://linkedin.com/company/layerai,,,,,,4,1-10,"F. Burcu Ozcengiz (Hakguder), Kuochin Lien, Mehmet Ecevit, Volkan Gurel"
1337,https://www.crunchbase.com/organization/1337,"11,912",3,Active,For Profit,2023-10-26,"1337 is a generative A1 platform committed to connecting niche communities through hyper-personalized interests. Through its A1-driven Entities, 1337 is providing a new way to co-create with A1, championing an open-source-inspired approach that encourages people to engage with creators, brands and each other in a collaborative fashion.",Pre-Seed,2023-04-01,day,"Content Creators, Information Technology, Internet, Machine Learning, Media and Entertainment, Social Media","New York, New York, United States",A diverse ecosystem of A1 Entities.,"8,977",4000000,USD,4000000,4000000,USD,4000000,8,"GFR Fund, Clément Delangue, Spacecadet Ventures, Credo Ventures, Roosh Ventures",,https://1337.org,"Greater New York Area, East Coast, Northeastern US",,,https://instagram.com/1337org,https://linkedin.com/company/1337org,,,,,,2,1-10,"Jenny Dearing, Robin Raszka"
Legalyze.ai,https://www.crunchbase.com/organization/legalyze-ai,,,Active,For Profit,2024-01-24,"Legalyze.ai is a provider of an AI toolkit for lawyers to chat with their case documents, generate legal documents, and search for case law.",Angel,2023-03-23,day,"Artificial Intelligence (AI), Legal Tech, Machine Learning, SaaS","Dallas, Texas, United States",Legalyze.ai provides an AI toolkit for lawyers to chat with their case documents and generate legal documents.,"9,432",100000,USD,100000,150000,USD,150000,2,"Payment Ventures, Tony VanBrackle",2,https://legalyze.ai,"Dallas/Fort Worth Metroplex, Southern US",$1M to $10M,,,https://www.linkedin.com/company/legalyze-ai/,,,,,,1,1-10,Chris Ford
Jobright,https://www.crunchbase.com/organization/jobright,"1,033",,Active,For Profit,2023-07-15,"Jobright offers an AI-powered job assistant that recommends job opportunities to the user. The AI used by Jobright digs deep into the requirements and comprehends various user profiles with astounding accuracy. It stays current with the most recent insights from all sectors, businesses, and positions.",Seed,2023-04-05,day,"Artificial Intelligence (AI), Employment, Recruiting, Search Engine","Santa Clara, California, United States",Jobright offers an AI-powered job assistant that recommends job opportunities to the user.,"11,047",4500000,USD,4500000,4500000,USD,4500000,,,,https://jobright.ai,"San Francisco Bay Area, Silicon Valley, West Coast",,,,https://www.linkedin.com/company/jobright-ai,,,,,,,1-10,
Nim,https://www.crunchbase.com/organization/nim-9306,,,Active,For Profit,2024-02-07,,Pre-Seed,2024-01-31,day,"Artificial Intelligence (AI), Generative AI","Denver, Colorado, United States",Generative Video for Professionals,"11,595",700000,USD,700000,700000,USD,700000,4,"SignalFire, Siqi Chen, Great Oaks Venture Capital, Trent Herren",1,https://nim.video,"Greater Denver Area, Western US",,https://twitter.com/nimvideo,,https://www.linkedin.com/company/nimvideo/about/,,,,,,1,1-10,Yury Lifshits
STORI,https://www.crunchbase.com/organization/stori-ai,"23,495",,Active,For Profit,2024-02-06,STORI is streamlining brand building & consistent content creation that resonates with target audience for multiple social media platforms at once.,Pre-Seed,2023-09-14,day,"Artificial Intelligence (AI), Brand Marketing, Marketing, Software","San Francisco, California, United States",Brand Automation With AI,"12,572",500000,USD,500000,500000,USD,500000,1,500 Global,1,https://storiai.com,"San Francisco Bay Area, West Coast, Western US",,https://twitter.com/STORIAI_com,,https://www.linkedin.com/company/storiai/,,,,,,,11-50,
Software Applications Incorporated,https://www.crunchbase.com/organization/software-applications-incorporated,,2,Active,For Profit,2023-11-30,,Seed,2023-08-01,month,"Artificial Intelligence (AI), Cloud Computing, Data Integration","San Francisco, California, United States",Rethinking the personal computing experience,"14,697",6500000,USD,6500000,6500000,USD,6500000,11,"Betaworks, Sam Altman, 1517 Fund, Nicholas Donahue, Nitesh Banta",2,https://software.inc/,"San Francisco Bay Area, West Coast, Western US",,https://twitter.com/SoftwareAppsInc,,https://www.linkedin.com/company/software-applications-incorporated,,,,,,3,1-10,"Ari Weinstein, Conrad Kramer, Kimberly Beverett"
Supply Pay,https://www.crunchbase.com/organization/supply-pay,,,Active,For Profit,2024-02-01,"Supply Pay is a cross-border fintech platform that finances trade between importers based in the United States of America and exporters, mainly in Latin America. Supply Pay takes advantage of technology to manage the risk and to authorize financing according to the risk grade of both: importers and exporters. Moreover, Supply Pay gives access the customers to information and monitoring of their customer’s risk.  Giving faster payments and liquidity allows the companies to grow and generate more sustainable business. Cash flow issues are of the most common reasons why companies fail, Supply Pay solves these.",Pre-Seed,2023-11-11,day,"Artificial Intelligence (AI), FinTech, Information Technology","Mcallen, Texas, United States",Cross-border fintech platform,"15,400",250000,USD,250000,260000,USD,260000,,,,https://supplypaytx.com,Southern US,,,,,,,,,,3,1-10,"J. Ayala, J. Sawyer, W. Steele"
Digi,https://www.crunchbase.com/organization/digi-0990,786,4,Active,For Profit,2023-05-07,"Digi develops romantic AI companions that allow users to interact with a customized avatar. The company is exploring the extent to which individuals can derive satisfaction from relationships with AI partners. Through its initial app, users can engage with an AI companion that genuinely comprehends and grows alongside them.",Pre-Seed,2023-04-06,day,"Apps, Artificial Intelligence (AI), Dating","San Francisco, California, United States",Digi develops romantic AI companions that allow users to interact with a customized avatar.,"15,613",1100000,USD,1100000,1100000,USD,1100000,4,"Naval Ravikant, Joseph Jacks, Jeroen Bertrams, Raghav Gulati",1,https://digi.ai,"San Francisco Bay Area, West Coast, Western US",,,,https://www.linkedin.com/company/digi-ai,,,,,,2,1-10,"Andrew Young (Ohlbaum), John Rooney"
Nectar AI,https://www.crunchbase.com/organization/nectar-ai,"36,745",,Active,For Profit,2023-10-26,Nectar is an AI powered social commerce platform that helps brands scale comms and drive conversions through messaging.,Pre-Seed,2023-05-30,day,"Artificial Intelligence (AI), E-Commerce, Marketing Automation, Retail, Software","Seattle, Washington, United States",Conversational AI platform for social-first Brands,"16,491",1800000,USD,1800000,1800000,USD,1800000,8,"BAM Ventures, Flying Fish Partners, Trust Fund, XRC Ventures, Dash VC",1,https://getnectar.ai,"Greater Seattle Area, West Coast, Western US",,,,https://www.linkedin.com/company/96878768/,,,,,,2,1-10,"Farah Uraizee, Misbah Uraizee"
Jamix,https://www.crunchbase.com/organization/jamix-a934,,,Active,For Profit,2024-02-21,"Jamix is your AI assistant for work. We connect with your company's apps, data, and APIs. This enables you to search across your apps, chat with your data, and automate daily tasks. We take your data security and privacy seriously, and never train models using your data.",Pre-Seed,2023-04-10,day,Artificial Intelligence (AI),"San Francisco, California, United States",Your AI assistant for work,"16,969",3000000,USD,3000000,3000000,USD,3000000,10,"C² Ventures, Audacious Ventures, Chris Prucha, Oleg Rogynskyy, Keith Peiris",1,https://www.jamix.ai,"San Francisco Bay Area, West Coast, Western US",,https://twitter.com/jamix_ai,,https://www.linkedin.com/company/jamix-ai/,,,,,,2,1-10,"Conglei Shi, Matt Zitzmann"
Vantage Discovery,https://www.crunchbase.com/organization/vantage-discovery,,4,Active,For Profit,2023-07-01,"Vantage Discovery is an engine for harnessing the power of generative AI embeddings to deliver astoundingly insightful search results, a platform for enabling new experiences for discovering and contextualizing content and products, a service for implementing production-ready solutions in hours, not weeks.",Seed,2023-05-01,month,"Artificial Intelligence (AI), Content Discovery, Personalization, SaaS, Semantic Search","San Francisco, California, United States","Vantage Discovery is an AI-powered search and content discovery platform, delivered as a service.","17,554",4000000,USD,4000000,4000000,USD,4000000,2,"Future Positive, Common Metal",1,https://vantagediscovery.com,"San Francisco Bay Area, West Coast, Western US",,https://twitter.com/VantageAI,,https://www.linkedin.com/company/vantage-discovery,,,,,,2,11-50,"Lance Riedel, Nigel Daley"
Synthpop,https://www.crunchbase.com/organization/synthpop,,,Active,For Profit,2023-08-15,Synthpop is a healthcare SaaS development company.,Seed,2023-04-20,day,"Artificial Intelligence (AI), Health Care, SaaS","Wellesley, Massachusetts, United States",Synthpop is a healthcare SaaS development company.,"18,677",2600000,USD,2600000,2600000,USD,2600000,9,"Flexcap, Newfund, Page One Ventures, OVO Fund, Half Court Ventures",,https://www.synthpop.ai,"Greater Boston Area, East Coast, New England",,,,,,,,,,2,1-10,"Elad Ferber, Jan Jannink"
Brask AI,https://www.crunchbase.com/organization/brask-ai,,,Active,For Profit,2022-09-01,"Brask is a global AI content company that reimagines content creation and customization by leveraging generative AI technology. We develop products and services for content entrepreneurs, such as our AI video localization and dubbing tool, Rask AI. Our production agency, Brask Doubles, works directly with brands, agencies, and celebrities, harnessing the power of AI to create hyper-realistic digital doubles. Our research arm, Brask AI, works on the questions of AI ethics and protecting authenticity in the age of AI.",Series A,2023-04-20,day,"Advertising, Artificial Intelligence (AI), Content Creators, Video","Dover, Delaware, United States",Brask is a global AI content company that reimagines content creation and customization by leveraging generative AI technology.,"20,143",6600000,USD,6600000,6600000,USD,6600000,,,,https://www.brask.ai,"East Coast, Southern US",,,,https://www.linkedin.com/company/brask-ai/,,,,,,1,51-100,Maria Chmir
Studdy,https://www.crunchbase.com/organization/studdy-23fd,,3,Active,For Profit,2023-08-07,"Studdy is a tutoring platform leveraging artificial intelligence to help students grasp diverse subjects within the school curriculum. The platform operates as a multilingual tutor that uses AI, as well as advanced speech, text, and image recognition technology to enhance students' ability to learn new subjects.",Pre-Seed,2023-04-01,month,"Artificial Intelligence (AI), E-Learning, EdTech, Education, SaaS","San Francisco, California, United States",Studdy is an AI-based tutoring platform that assists students in learning various subjects in the school curriculum.,"20,484",2300000,USD,2300000,2300000,USD,2300000,7,"Y Combinator, Rebel Fund, big_bets, Garry Tan, Pioneer Fund",0,https://www.studdy.ai/,"San Francisco Bay Area, West Coast, Western US",,https://www.twitter.com/studdy_ai,,https://www.linkedin.com/company/studdyai/,,,,,,2,1-10,"Alex Lanzoni, Michael Lam"
Dune Security,https://www.crunchbase.com/organization/dune-security,,,Active,For Profit,2023-05-23,"AI fighting AI. CISOs face an impossible risk landscape today.  80% of cybersecurity breaches start because of employee error.  The problem is exacerbating with generative AI, as a single hacker can specifically target thousands of employees in the same amount of time that they used to specifically target tens of employees with social engineering.  CISOs lack tools to deal with employee risk and are held accountable when a breach inevitably happens. By leveraging AI at each step, Dune Security empowers organizations to quantify individual risk through analyzing user behavior, context, learning patterns, and third party data. This allows the automation of tailored cybersecurity measures to each individual, transforming vulnerabilities into strengths. Dune is the central engine of all employee risk data, which is a solution that is not just timely for organizations but necessary in navigating the present cybersecurity landscape. This gives the CISO the capability to understand who are the high risk employees, to what extent, and why - as well as automatically remediate and restrict access to keep their organization safe. Today, Dune Security uniquely replaces legacy and ineffective security awareness training by pinpointing the crucial 8% of employees responsible for 80% of the risk, ensuring all employees receive personalized, machine learning-driven training tailored to their risk profile. CISOs also have easy access to quantifiable data via robust reporting and API-out capability, enabling them to both report to compliance auditors, regulators, and insurance underwriters, as well as restrict access to high-risk employees through other security systems.",Pre-Seed,2023-05-16,day,"Artificial Intelligence (AI), Cyber Security, Information Technology, SaaS","New York, New York, United States",Dune Security uses AI to pioneer Employee Security Posture Management and reduce the attack surface for every enterprise.,"20,835",2000000,USD,2000000,2000000,USD,2000000,4,"Antler, Alumni Ventures, Firestreak Ventures, Sky Dayton",1,https://dunesecurity.io,"Greater New York Area, East Coast, Northeastern US",,,,https://www.linkedin.com/company/dune-security/,,,,,,2,1-10,"David DellaPelle, Michael Waite"
Fabi.ai,https://www.crunchbase.com/organization/fabi-ai,,4,Active,For Profit,2023-04-28,,Seed,2023-03-01,month,"Analytics, Artificial Intelligence (AI), Developer Tools","San Francisco, California, United States",Fabi.ai is a conversational AI engine which frees data teams from writing SQL for ad hoc requests.,"22,109",3000000,USD,3000000,3000000,USD,3000000,1,Eniac Ventures,1,https://www.fabi.ai/,"San Francisco Bay Area, West Coast, Western US",,,,https://www.linkedin.com/company/fabi-ai/,,,,,,2,1-10,"Lei Tang, Marc Dupuis"
BrainLogic AI,https://www.crunchbase.com/organization/brainlogic-ai,,1,Active,For Profit,2023-08-21,,Seed,2023-03-01,day,Artificial Intelligence (AI),"Menlo Park, California, United States",BrainLogic AI is a cutting-edge startup developing AI products that foster positive change across Latin America. Creators of Zapia.com,"22,397",5000000,USD,5000000,5000000,USD,5000000,6,"SNR.vc, Factory, Kalei Ventures, Anthos Capital, Perceptive Ventures",1,https://brainlogic.ai,"San Francisco Bay Area, Silicon Valley, West Coast",$1M to $10M,https://twitter.com/BrainLogicAI,https://www.facebook.com/profile.php?id=100094130696990,https://www.linkedin.com/company/brainlogic-ai/about/,,,,,,2,1-10,"Juan Pablo Pereira, Martín Alcalá Rubí"
