Soundverse,https://www.crunchbase.com/organization/soundverse,,,Active,For Profit,,"Soundverse is an AI Assistant that allows content and music creators to create original content in a flash using Generative AI.  With the help of Soundverse Assistant and AI Magic Tools, our users get an unfair advantage over other creators to create audio and music content quickly, easily and cheaply.  Soundverse Assistant is your ultimate music companion. You simply speak to the assistant to get your stuff done. The more you speak to it, the more it starts understanding you and your goals.  AI Magic Tools help convert your creative dreams into tangible music and audio. Use AI Magic Tools such as text to music, stem separation, or lyrics generation to realise your content dreams faster. Soundverse Blog: https://www.soundverse.ai/blog",,2023-10-10,day,"Artificial Intelligence (AI), Audio, Audio Recording and Production, Content Creators, Generative AI, Information Technology, Machine Learning, Music, Software","New York, New York, United States","SaaS, AI, Music Tech,","197,720",,,,,,,,,,https://www.soundverse.ai,"Greater New York Area, East Coast, Northeastern US",,https://www.twitter.com/soundverse_ai,https://www.facebook.com/profile.php?id=100095674445607,https://www.linkedin.com/company/soundverseai,,,,,,2,1-10,"Philip Srebrev, Sourabh Pateriya"
Kaiden AI,https://www.crunchbase.com/organization/kaiden-ai,"2,195",1,Active,For Profit,,"Kaiden is a comprehensive AI-driven platform tailored to transform the landscape of academic and corporate education by offering personalized learning experiences and streamlining training processes. Leveraging advanced algorithms and machine learning, Kaiden analyzes individual learning patterns and performance data to create customized learning paths for each user, ensuring maximum engagement and efficiency. For organizations, Kaiden automates time-consuming administrative tasks, from grading and attendance tracking to compliance management, enabling educators and trainers to focus on strategic educational goals. Integrating seamlessly with existing Learning Management Systems (LMS) and corporate data sources, Kaiden adheres to stringent AI ethics and data privacy standards, providing a secure, scalable solution for educational institutions and businesses aiming to foster a culture of continuous learning and development.",,2023-06-19,day,"Artificial Intelligence (AI), Corporate Training, EdTech, Generative AI, Higher Education, Natural Language Processing, SaaS","Wilmington, Delaware, United States",Kaiden is an AI platform that enhances academic education and corporate training with tailored learning paths and automated admin tasks.,"198,092",,,,,,,,,,https://kaiden.ai/,"Greater Philadelphia Area, East Coast, Southern US",,https://twitter.com/kaiden_ai,https://www.facebook.com/kaidenai,https://www.linkedin.com/company/kaiden-ai/,,,,,,3,1-10,"Ali Aldjaei, Ali Aldubaisi, Hamzah Aldubaisi"
Hirebase,https://www.crunchbase.com/organization/hire-base,,,Active,For Profit,,"Hirebase is an easy to use drag & drop AI for matching resume’s with vacancies for Recruiters and HR professionals. Advanced Artificial Intelligence is applied to the resume’s of candidates and cross references the data with any vacancies that you upload. The AI can also cross-reference resume’s with any other vacancies you’ve uploaded to see if there’s a potential better match on other jobs. The AI is self-learning, meaning each time you upload a resume or vacancy the data-model improves.",,2023-12-26,day,"Artificial Intelligence (AI), B2B, Human Resources, Recruiting, SaaS","Dover, Delaware, United States",The Best Drag & Drop AI for Vacancy & Resume Matching for Recruiters and HR professionals.,"199,626",,,,,,,,,,https://hirebase.ai,"East Coast, Southern US",,https://twitter.com/hirebaseai,https://facebook.com/hirebaseai,https://linkedin.com/company/hirebaseai,,,,,,2,1-10,"Randy Vanenburg, Thomas van der Voort"
RealCDT,https://www.crunchbase.com/organization/realcdt,,,Active,For Profit,,,,2024-01-10,day,"Artificial Intelligence (AI), Machine Learning, PropTech, Real Estate, Real Estate Brokerage, Software","New York, New York, United States","Real estate technology made for humans, supported by AI","200,637",,,,,,,,,,,"Greater New York Area, East Coast, Northeastern US",,,,,,,,,,2,1-10,"Duane Moore, TBD TBD"
AI Magicx,https://www.crunchbase.com/organization/ai-magicx,,,Active,For Profit,,"AI Magicx is an advanced artificial intelligence company specializing in the development of cutting-edge AI-powered content creation tools. Our platform offers a wide array of features, designed to streamline and enhance the production of digital content. We provide solutions such as an AI Image Generator, AI Article Generator, AI logo Designer, AI Story Creator and are on track to introduce an AI Chatbots community (Users can create their own bots). Our tools are expertly crafted to cater to the needs of professionals seeking efficient, high-quality, and engaging content creation.",,2023-11-01,day,"Advertising, Artificial Intelligence (AI), Generative AI, Marketing, SaaS, Software","Delaware, Ohio, United States","Transform your ideas into stunning images, logos, and articles with AI Magicx.","202,483",,,,,,,,,,https://aimagicx.com/,"Great Lakes, Midwestern US",,https://twitter.com/aimagicx,https://www.facebook.com/aimagicx,https://www.linkedin.com/company/aimagicx,,,,,,,1-10,
Myto AI,https://www.crunchbase.com/organization/myto-ai,,,Active,For Profit,,"Myto is the world's first secured gateway and API service for any enterprise integrating LLM's and building applications. Myto brings a security and privacy gateway via a simple API as a service so that every database, API and workflow can provide best-of-breed protection when interacting with LLMs.",,2023-09-22,day,"Artificial Intelligence (AI), B2B, Information Technology, Machine Learning, SaaS, Security","San Francisco, California, United States","Myto is a secured gateway/API protecting databases, and APIs of the enterprise when interacting with LLM's to build Gen AI applications.","202,702",,,,,,,,,,https://www.myto.ai,"San Francisco Bay Area, West Coast, Western US",,,,https://www.linkedin.com/company/mytoai/,,,,,,3,1-10,"Makhan Virdi, Sandeep Giri, Srinivas Mothey"
LeadForceTalent,https://www.crunchbase.com/organization/leadforcetalent,,,Active,For Profit,2023-11-03,"irst AI Top and Middle Management Recruitment Platform delivering candidates 10X faster It take 100 hours to find, check and interview a top management candidate. It’s 10X comparing to average specialist. No top-manager - the business is not growing and losing owner’s money. LeaForceTalent gives access to 25M database of C-level candidates, automatically interviews, checks skills with AI based on Blockchain and get hundreds of replies from candidates with one click.",Seed,2023-04-19,day,"Artificial Intelligence (AI), Human Resources, Recruiting","Stanford, California, United States",First AI Top and Middle Management Recruitment Platform delivering candidates 10X faster,"203,267",,,,,USD,,,,,https://www.leadforcetalent.com/,"San Francisco Bay Area, West Coast, Western US",,,,https://www.linkedin.com/company/leadforcetalent/,,,,,,2,1-10,"Dmytro Rodenko, Vitalii Lubinets"
Runbear,https://www.crunchbase.com/organization/runbear,,,Active,For Profit,2023-08-08,"Runbear is creating a B2B SaaS that effectively enhances work processes from application development to operation by fusing artificial intelligence with the tools used by DevOps professionals. Through task automation, which is the foundation of IT service operation, it seeks to reduce inefficiencies and boost stability and speed. With the use of this investment lure, we intend to aggressively acquire clients.",Pre-Seed,2023-03-10,day,"Artificial Intelligence (AI), B2B, DevOps, Information Technology, SaaS","Middletown, Delaware, United States",Runbear is an AI-based IT operation automation service provider.,"203,468",,,,,USD,,2,"Kakao Ventures, Base Investment",,https://www.runbear.io,"Greater Philadelphia Area, East Coast, Southern US",,https://twitter.com/runbear_io,,https://www.linkedin.com/company/runbear,,,,,,,1-10,
Mystory,https://www.crunchbase.com/organization/mystory,44,,Active,For Profit,2023-10-20,,Pre-Seed,2023-05-20,day,"Artificial Intelligence (AI), Digital Entertainment, Gift, mHealth","Delaware, Ohio, United States",Mystory supporting mental health by Generative AI content.,"204,894",,,,,USD,,,,,https://mystory.gift/,"Great Lakes, Midwestern US",,,,https://www.linkedin.com/company/mystory-ink,,,,,,,11-50,
Smartschool,https://www.crunchbase.com/organization/smartschool,54,,Active,For Profit,,"Intelligent learning app, equipped with an AI tutor. Founded in 2023, Smartschool is based in San Francisco, California.",,2023-09-01,day,"Artificial Intelligence (AI), EdTech","San Francisco, California, United States","Learning companion for K-12 students, with individualized, meaningfully engaging AI.","205,528",,,,,,,,,,https://www.joinsmartschool.com/,"San Francisco Bay Area, West Coast, Western US",,,,https://www.linkedin.com/company/smartschoolcom/,,,,,,3,1-10,"Agata Mroczkowska, Matt Maslowski, Paul Burzynski"
CloakAI,https://www.crunchbase.com/organization/cloakai,,,Active,For Profit,,"CloakAI is at the forefront of AI-driven privacy and security solutions, pioneering the field of digital data cloaking. Our cutting-edge technology is designed to protect digital assets from unauthorized AI detection and misuse. We empower individuals and organizations to maintain control over their digital identities, ensuring privacy and security in an AI-dominated landscape.",,2024-01-01,day,"Artificial Intelligence (AI), Cyber Security, Data Management, Digital Signage","Charlotte, North Carolina, United States","CloakAI pioneers in AI-driven privacy, offering advanced digital cloaking to safeguard digital identities and assets.","205,633",,,,,,,,,,https://cloakit.ai,"East Coast, Southern US",,,,https://www.linkedin.com/company/cloakai,,,,,,1,1-10,Dennis Ganesh
Gumption,https://www.crunchbase.com/organization/gumption-9ef3,,,Active,For Profit,,Gumption is an AI-powered platform reimagining how everyday homeowners renovate. We are a dedicated design-led team of former Google & IDEO Engineers and Architects who have joined together to build a radical new venture.,,2023-07-01,month,"Artificial Intelligence (AI), Consumer Software, PropTech, Software","Palo Alto, California, United States","AI, Consumer Tech, Home Renovation, Design","210,178",,,,,,,,,,http://getgumption.co,"San Francisco Bay Area, Silicon Valley, West Coast",,,,,,,,,,2,1-10,"Darren Ray, Kris Woyzbun"
Aimon,https://www.crunchbase.com/organization/aimon-2d14,,,Active,For Profit,,,,2023-07-01,month,"Artificial Intelligence (AI), Generative AI","San Francisco, California, United States",Aimon is developing proprietary technology to continuously monitor LLM Hallucinations and improve underlying models.,"211,727",,,,,,,,,,https://aimon.ai,"San Francisco Bay Area, West Coast, Western US",,,,https://www.linkedin.com/company/aimon-ai/?viewAsMember=true,,,,,,,1-10,
Quiver,https://www.crunchbase.com/organization/quiver-io,,,Active,For Profit,,"Quiver: where love meets security.  AI crafts tailor-made matches, unifying dating, lifestyle content, and LGBTQ+ resources - all encrypted for your privacy.  Discover connections that resonate in a uniquely secure, inclusive space.",,2023-08-01,day,"Android, Artificial Intelligence (AI), B2C, Dating, iOS, LGBT, Lifestyle, Media and Entertainment, Social Network, Software","Seattle, Washington, United States","Dating, Mobile, Artificial Intelligence, Software, Platforms","213,379",,,,,,,,,,https://www.joinquiver.com,"Greater Seattle Area, West Coast, Western US",,https://www.twitter.com/joinquiver,https://www.facebook.com/profile.php?id=61552830692493&mibextid=9R9pXO,https://www.linkedin.com/company/quiver-io/,,,,,,1,1-10,Christopher Nagy
GalacticLeap,https://www.crunchbase.com/organization/galacticleap,,,Active,For Profit,,"At GalacticLeap, we’re on a mission to help the financial services industry accelerate the fight against money laundering and financial crime and foster a safer, more stable and transparent global financial ecosystem. Our responsible AI-driven financial crime-fighting cloud platform built on a foundation of unified data is your one trusted place to improve money laundering risk detection & investigation, centralize & scale your anti-financial crime program, and manage & streamline the entire AML KYC compliance journey with your customers and partners. Unlock your Financial Crime-Fighting Potential today!",,2023-05-15,day,"Artificial Intelligence (AI), FinTech, Machine Learning, SaaS","Miami, Florida, United States",GalacticLeap builds responsible AI-driven cloud solutions to help the financial services industry fight money laundering and financial crime,"215,940",,,,,,,,,,https://galacticleap.com/,"Greater Miami Area, East Coast, Southern US",,https://twitter.com/galacticleap,https://facebook.com/galacticleap,https://www.linkedin.com/company/galacticleap,,,,,,1,,Sean Lee
Corvus Link,https://www.crunchbase.com/organization/corvus-link,,,Active,For Profit,2023-10-26,"Corvus Link is an all-in-one solution for strategy execution and building resilient operating models.  Users can develop plans, build project portfolios, manage projects, manage action items and tasks, build dynamic dashboards, create resource centers, create diagrams, run continuous improvement events, conduct retrospectives, and communicate with each other in a single solution.  Our SaaS solution uses the transformative power of AI, automations, and integrations to help companies transform, optimize, and operate more efficiently with fewer applications.",Seed,2023-05-31,day,"Artificial Intelligence (AI), Business Intelligence, Data Visualization, Product Management, Productivity Tools, Project Management, Software, Unified Communications, Virtual Workforce, Wood Processing","Hillsboro, Oregon, United States",We help innovators build and grow businesses around their ideas.,"217,863",,,,,USD,,,,,https://www.corvuslink.com,"West Coast, Western US",,https://twitter.com/corvuslink23,,https://www.linkedin.com/company/corvus-link,,,,,,1,1-10,Jamie Robinson
Neptune Technologies,https://www.crunchbase.com/organization/neptune-technologies-7c4b,,,Active,For Profit,2023-08-01,,Seed,2023-06-22,day,"Artificial Intelligence (AI), Blockchain, Financial Services, Software, Trading Platform","Cape Coral, Florida, United States",Neptune Technologies: Redefining wealth management with AI and Blockchain.,"221,875",,,,,USD,,,,,https://neptunetechnologies.com,"East Coast, Southern US",,,,,,,,,,1,1-10,Joseph Rambow
"Stealth, AI Powered Web3 Security and Compliance Solution",https://www.crunchbase.com/organization/web3trust,,,Active,For Profit,,"Stealth is a revolution in Web3 Security using AI to protect from scams, fraud, and money laundry",,2023-04-19,day,"Artificial Intelligence (AI), Blockchain, FinTech, Machine Learning, Web3","San Francisco, California, United States","Stealth develops cutting edge web3 security solutions for wallet providers, crypto exchanges, NFT providers, and broadcast nodes","222,029",,,,,,,,,,,"San Francisco Bay Area, West Coast, Western US",,,,,,,,,,,1-10,
Ainekko,https://www.crunchbase.com/organization/ainekko,,3,Active,For Profit,,"A 100% open-source company on a mission to democratize how “the machine learning community collaborates on models, datasets, and applications” and helping “the AI community building the future” have more choices than just a single (albeit awesome!) walled garden.",,2023-10-10,day,"Artificial Intelligence (AI), Developer Platform, Developer Tools, Software","San Jose, California, United States","On an OSS mission to democratize how “the machine learning community collaborates on models, datasets, and applications”","223,589",,,,,,,,,,https://nekko.ai,"San Francisco Bay Area, Silicon Valley, West Coast",,,,https://www.linkedin.com/company/ainekko,,,,,,2,1-10,"Roman Shaposhnik, Tanya Dadasheva"
"PlayerScript AI, Inc.",https://www.crunchbase.com/organization/xgaming-bfc9,,,Active,For Profit,2023-09-10,Empowering creators to build games/game assets using Generative AI.,Pre-Seed,2023-07-18,day,"Artificial Intelligence (AI), Gaming, Mobile Apps","Palo Alto, California, United States","Gaming, Generative AI","224,083",,,,,USD,,1,Hashed Emergent,1,https://www.xgaming.club,"San Francisco Bay Area, Silicon Valley, West Coast",,,,https://www.linkedin.com/company/xgamingclub,,,,,,,11-50,
ChatMemoir,https://www.crunchbase.com/organization/chatmemoir,,,Active,For Profit,,"At ChatMemoir, our goal is to bring people and families together in meaningful ways. Our patented products use Conversational and Generative AI to help you create memoirs based on an AI-led interview,  photos, social media, internet & public sources, and other media, making it fun to overcome technology fears and bridge barriers to connect generations of people.",,2023-03-30,day,"Generative AI, Internet, Software","Naperville, Illinois, United States",ChatMemoir brings people closer with patented Generative AI in a fun and easy way to create memoirs with peoples’ life stories and media.,"224,935",,,,,,,,,,https://www.chatmemoir.com,"Greater Chicago Area, Great Lakes, Midwestern US",,https://twitter.com/ChatMemoir,,https://www.linkedin.com/company/chatmemoir/,,,,,,2,1-10,"Rachel Koritala, Srirajasekhar Koritala"
AcquireAI,https://www.crunchbase.com/organization/acquireai,,,Active,For Profit,2023-09-02,,Pre-Seed,2023-08-28,day,"Artificial Intelligence (AI), Marketplace","Dover, Delaware, United States",AI Acquisition platform,"226,231",,,,,USD,,,,,https://www.aiquare.com/,"East Coast, Southern US",,https://twitter.com/aquireai,,https://linkedin.com/company/acquireai,,,,,,1,1-10,Jason Clinton
Signlz,https://www.crunchbase.com/organization/signlz,22,,Active,For Profit,,"Signlz: Your AI-powered Product Studio. Streamline PRD creation, automate technical specs, and seamlessly break down tasks for efficient product management. Effortless Product Management: At Signlz, we're transforming the way product professionals handle their workflow. Our AI-driven platform simplifies and streamlines every stage of product development, from vision to execution. AI-Powered PRD Creation: Describe your vision in plain English, and let our AI do the rest. Crafting professional Product Requirements Documents (PRDs) has never been easier. Our tool ensures consistency and alignment with your product goals, saving you time and enhancing precision. Automated Technical Specifications: We go beyond PRDs. Signlz assists in generating and refining detailed technical specifications, ensuring every aspect of your product is well-documented and clearly defined. Seamless Task Integration: With Signlz, the journey from a PRD to actionable tasks is smooth and efficient. Automatically break down specifications into Epics, Stories, and Sub-tasks, and integrate them with your favorite task management tools like Jira, Asana, Trello, Linear, Notion, and more in just a few clicks. Why Signlz?: We're more than just a tool; we're a partner in your product management journey. Built on a decade of product landscape experience, Signlz is tailored for the unique challenges and needs of today's product teams. Our platform combines a structured approach with a specialized knowledge base, ensuring you stay ahead in a competitive market.",,2023-11-01,month,"Analytics, Artificial Intelligence (AI), Business Intelligence, Machine Learning, Natural Language Processing, SaaS, Software","San Francisco, California, United States",Your AI-powered Product Studio.,"226,863",,,,,,,,,,https://www.signlz.co/,"San Francisco Bay Area, West Coast, Western US",,https://twitter.com/getsignlz,,https://www.linkedin.com/company/signlz,,,,,,,1-10,
Insight Health,https://www.crunchbase.com/organization/insight-health-ai,,1,Active,For Profit,,"Insight Health AI operates in the healthcare industry, focusing on the application of artificial intelligence (AI) and machine learning techniques. The company's primary product, inGAGE™, utilizes connected data in real-time to generate insights. These insights are used to streamline clinical workflows and personalize patient care. The company also explores the use of AI in cardiology, including enhanced imaging interpretation and predictive analytics. Additionally, Insight Health AI is developing a patient engagement platform powered by AI.",,2023-08-23,day,"Artificial Intelligence (AI), Health Care, Software","Austin, Texas, United States","Insight Health applies AI and machine learning in healthcare, offering an AI virtual assistant for specialist physicians in high demand","229,357",,,,,,,,,,https://insighthealth.ai,Southern US,,,,https://www.linkedin.com/company/insight-health-ai,,,,,,4,1-10,"Dr. Eric Stecker, Dr. Pankaj Gore, Jaimal Soni, Saran Siva"
QUBY,https://www.crunchbase.com/organization/quby-224b,,,Active,For Profit,2023-06-03,"Quby, an AI-powered company, is at the forefront of transforming businesses with its innovative artificial intelligence solutions. Their cutting-edge technology and expertise empower organizations to optimize operations, enhance decision-making, and drive efficiency across various industries.",Venture - Series Unknown,2024-01-01,year,"Artificial Intelligence (AI), Cloud Computing, Machine Learning, Natural Language Processing","New York, New York, United States","Quby is an AI-powered company, transforming businesses with innovative artificial intelligence solutions.","231,250",,,,,USD,,,,,https://www.quby.ai/,"Greater New York Area, East Coast, Northeastern US",,,,https://www.linkedin.com/company/quby-ai,,,,,,1,1-10,Gary Brar
Locusive,https://www.crunchbase.com/organization/locusive,,1,Active,For Profit,,"Hey there, welcome to Locusive. If you've ever navigated the maze of a SaaS tool and wished for a quicker way to find answers, or if you're a CSM feeling the weight of endless queries, we see you. We've been there too. We've seen time and again how important it is to service customers quickly, effectively, and accurately. Most businesses struggle to get customers everything they want and need when they ask for it. CSMs spin their wheels with data pulls, engineers that should be working on product have to come up with quick queries, and there's no time to service the long-tail of smaller customers that are all trying to gain value from your business or product. That's where the idea for Locusive was born. Our goal is to create an AI assistant that feels like a guide or concierge for your business. For users, it's about streamlining those moments of ""how do I...?"" and turning them into ""oh, that's how!"". And for the CSMs, it's about filtering out the noise, letting you focus on the deeper, more strategic aspects of your role. We're on a journey to blend technology with a bit of that human touch, making the digital space feel a tad more navigable and friendly. Interested in the evolving landscape of customer success and AI's role in it? Check us out at locusive.com.",,2023-03-01,month,"Artificial Intelligence (AI), Enterprise Software, Information Technology, SaaS, Software","New York, New York, United States",We're creating an AI concierge for businesses that lets their users self-service while freeing up CSMs for bigger tasks.,"233,033",,,,,,,,,,https://www.locusive.com,"Greater New York Area, East Coast, Northeastern US",,https://twitter.com/Locusive,,https://linkedin.com/company/locusive,,,,,,1,1-10,Shanif Dhanani
Backplain,https://www.crunchbase.com/organization/backplain,575,,Active,For Profit,,"We are the backplane for all AI models. We connect and control these models in simple interface. We enable search, logging, analytics, compliance, policy enforcement, security, usage guides, validation,  recommendations, and quality assurance.",,2023-04-26,day,"Artificial Intelligence (AI), Compliance, Generative AI, SaaS, Software","Carlsbad, California, United States",We are the backplane for all AI models. We connect and control these models in simple interface.,"233,878",,,,,,,,,,https://backplain.com,"Greater San Diego Area, West Coast, Western US",,https://twitter.com/backplain,https://www.facebook.com/thebackplain,https://www.linkedin.com/company/backplain,,,,,,4,11-50,"Kevin Hannah, Michael Stiles, Reed Anderson, Tim O'Neal"
Linkt,https://www.crunchbase.com/organization/skillflow-95c1,,,Active,For Profit,,,,2023-08-05,day,"Artificial Intelligence (AI), Generative AI, Software","Austin, Texas, United States",AI solutions for innovative companies.,"235,238",,,,,,,,,,https://www.linkt.ai/,Southern US,,https://twitter.com/_linktai,,https://www.linkedin.com/company/linktai/,,,,,,2,11-50,"Jack Moffatt, Reid McCrabb"
Apers,https://www.crunchbase.com/organization/authentiai,,,Active,For Profit,,"Apers: AI-autopilot platform for Institutional Real Estate Investors, offering automated due diligence, market analysis, and investment insights. Integrates with your systems for strategic, data-driven decision-making in commercial real estate investment.",,2023-04-01,day,"Artificial Intelligence (AI), Information Technology, Real Estate, Software","Cambridge, Massachusetts, United States",Automate the Future of Alternative Assets with AI,"235,900",,,,,,,,,,https://www.apers.app/,"Greater Boston Area, East Coast, New England",,,,https://www.linkedin.com/company/95766193,,,,,,2,1-10,"Francis Huang, Gavin Guo"
