Sparkyai private limited,https://www.crunchbase.com/organization/sevak22,Active,For Profit,,Sparkyai offers an AI agricultural tool that is designed to empower farmers with modern agricultural knowledge.,,2023-12-26,day,"AgTech, Artificial Intelligence (AI), Consulting, Horticulture, Information Technology, Machine Learning, Service Industry","Bangalore City, Karnataka, India",Sparkyai offers an AI agricultural tool that is designed to empower farmers with modern agricultural knowledge.,"245,561",,,,,,,,,
Toma,https://www.crunchbase.com/organization/toma-7107,Active,For Profit,,Automate phone calls with AI,,2023-12-01,month,"Artificial Intelligence (AI), Call Center, Software","New York, New York, United States","Artificial Intelligence, SaaS, Voice","246,013",,,,,,,,,
Nesto,https://www.crunchbase.com/organization/nesto-f502,Active,For Profit,,"Trusted Mortgage and Protection Experts leveraging innovative technology to make your life easier and secure. Here at Nesto we are changing the way people think about mortgages and protection. A staggering 64% of people applying for a mortgage or protection report feeling stressed or anxious about the process and we want that to change. By using AI and innovative technology, we are building a business which sets out to protect you are your family for life when making your biggest investment, your home, whilst removing the stress and anxiety so many feel. Our experts have access to leading technology meaning they can spend more time understanding your needs, finding you the best deal and guiding you through the process every step of the way. Our mortgage tracker then ensures you are always on the best deal available for your situation. Reach out to us today to find out how we can support you.",,2024-01-16,day,"Financial Services, FinTech, Information Technology, Mortgage","Manchester, Manchester, United Kingdom",Nesto is an online mortgage and insurance brokerage aiming to make lending and insurance as simple and accessible as possible to everyone.,"246,058",,,,,,,,,
Fxcept.com,https://www.crunchbase.com/organization/fxcept-com,Active,For Profit,,"At FxCept, our mission is to streamline cross-border receivables for B2B transactions, focusing on Global Suppliers of services or products. We provide a cost-effective, efficient platform for suppliers to receive international payments, enhancing their revenue streams and simplifying transactions for their clients. Our unique approach prioritizes supplier needs, offering ease of processing and compliance support, setting us apart in the market.",,2024-01-12,day,"Financial Services, FinTech","London, England, United Kingdom","Fxcept.com offers a platform for suppliers to receive international payments, enhancing revenue streams and transactions for the clients.","246,159",,,,,,,,,
Hengding Materials,https://www.crunchbase.com/organization/hengding-materials,Active,For Profit,2024-02-21,Hengding Materials is a manufacturer of hot isostatic pressing equipment for civilian usage. It offers cost-effective solutions for essential metal wear components in numerous industrial fields.,Seed,2024-01-01,year,"Advanced Materials, Manufacturing","Huzhou, Zhejiang, China",Hengding Materials is a manufacturer of hot isostatic pressing equipment for civilian usage.,"246,556",,,,,USD,,1,ZSVC,1
Rulewise AI,https://www.crunchbase.com/organization/rulewise-ai,Active,For Profit,,"Rulewise creates AI-powered applications for property managers, HOAs and condo associations to address the complexity of their community policies, rules and guidelines compliance. Rulewise provides auditing tools to ensure policies and guidelines are compliant with state and federal laws. Rulewise allows property managers to create virtual assistants to improve tenant/resident engagement and compliance.",,2024-01-15,day,"Artificial Intelligence (AI), Legal Tech, PropTech","Riverview, Florida, United States","AI-powered solutions for rental and HOA/Condo community policies, rules and guidelines compliance","246,964",,,,,,,,,
LifeLine.vet AI (SDVOSB),https://www.crunchbase.com/organization/lifeline-vet,Active,For Profit,,"Company Name: LifeLine.vet (SDVOSB) Business & Product Idea: LifeLine.vet is an AI journaling and assessment tool designed to detect and intervene in mental health crises, including suicidal, homicidal, terrorism-related ideation, as well as issues related to mental health disorders like schizophrenia, depression, anxiety, PTSD, and Military Sexual Trauma (MST). The company aims to help the veteran community, active duty, agencies, and civilians by providing MH caregivers and/or Leaders timely crisis intervention and support through AI-driven assessments. One of the primary goals is to prevent tragic events like suicide or the next Sandy Hook. Company Mission: LifeLine.vet's mission is to engage mental health teams, families, and leadership to reduce suicides, prevent homicides, stop mass violence, and support clinicians and leadership in their roles. The goal is to provide a supportive tool that allows professionals to focus on their work with reduced stress, knowing that an AI system is helping monitor and address mental health concerns. Target Market: The primary target markets for LifeLine.vet include veterans, active duty military, therapists, coaches, Ketamine Assisted Psychotherapy Clinics, the United States Government, the Department of Defense (DoD), Veteran's Affairs, 501(c)(3) organizations, military/government commands, clinics, psychologists and front lines around the globe and off planet for research missions, not just war.",,2024-01-30,day,"Artificial Intelligence (AI), Generative AI, Government, Law Enforcement, Mental Health, Military, Psychology, Space Travel","Monterey, California, United States","AI Mental Health Crisis Detection & Intervention to reduce & prevent; veteran & civilian suicide, homicide, mass violence & sexual offenses.","247,428",,,,,,,,,
Invessor,https://www.crunchbase.com/organization/invessor,Active,For Profit,,Fintech app for personal finance.,,2024-01-01,month,"Artificial Intelligence (AI), Chatbot, Finance, Financial Services, FinTech, Machine Learning, Mobile Apps, Personal Finance, Predictive Analytics, Software","Houston, Texas, United States",Fintech app for personal finance,"248,446",,,,,,,,,
Jack Bradley & Co,https://www.crunchbase.com/organization/jack-bradley-co,Active,For Profit,,"Welcome to Jack Bradley & Co., a reliable consulting partner for clients within the energy industry. At Jack Bradley & Co., we're dedicated to transforming the energy landscape one ""clean"" stride at a time through customer acquisition efforts. Jack Bradley & Co. offers expert consulting services to raise awareness and drive growth for our clients. As a trusted authority, we leverage our expertise to deliver customized, cost-effective solutions and foster business development in our community in Philadelphia, PA. Our team receives training to ensure top-notch service through every direct customer interaction. We're committed to our client's success and strive to elevate businesses with our expertise in customer acquisition and energy consulting. With our motto, ""inspired by people, driven by purpose,"" we're dedicated to advancing society while fostering collaboration and confidence. We aim to lead the industry and expand our clients outside of the Pennsylvania area. At Jack Bradley & Co., you're our priority!",,2024-01-01,year,"Consulting, Professional Services","Auburndale, Massachusetts, United States","As a leading consulting firm in Philadelphia, we are dedicated to empowering businesses through strategic guidance and innovative solutions.","249,484",,,,,,,,,
Seqnova Ventures,https://www.crunchbase.com/organization/seqnova-ventures,Active,For Profit,,"At Seqnova Ventures, we are a dynamic team committed to innovation in product development and marketing. We thrive on creativity and collaboration, aiming to transform visionary ideas into market-ready products and strategies.",,2023-12-14,day,"Advertising, Consulting, E-Commerce, Information Technology, Manufacturing, Marketing, Professional Services",,Product Development & Marketing Agency,"252,593",,,,,,,,,
Emilio,https://www.crunchbase.com/organization/emilio-81c1,Active,For Profit,,"Emilio is an AI-powered email manager that automates tasks to save users time. The key functionalities include sorting prioritized emails, summarizing messages and drafting emails with the user's tone. The service operates in the background and integrates with the Gmail account.",,2024-01-18,day,Software,"Madrid, Madrid, Spain","Stop drowning in emails - Emilio prioritizes and automates your email, saving 60% of your time","252,666",,,,,,,,,
OTR Pass,https://www.crunchbase.com/organization/otr-pass,Active,For Profit,,"OTR Pass is ClassPass for outdoor adventures ($1B) - one membership for thousands of outdoor adventure activities like surfing, skiing, climbing, foil boarding, and hundreds more with free gear rentals, 15-50% activity discounts, meetups and events enabled by OpenTable-like reservation optimization for group experiences. Our outdoor adventure marketplace serves our mission to build genuine community by getting people outside sharing discounted experiences together. We are completely changing the legacy (OTA) transaction model for guides, lessons and activities to unlock more value for our members in the highly fragmented Outdoor Recreation market - the 3rd largest US industry. We are a seasoned founding team of myself (Atomic Labs, 18 startups), Todd Paoletti (Cognizant CPO & GM Accelerator), Eric Moe (Co-Founder and CTO OpenTable), and Adrian Ballinger (professional big mountain climber and skier).",,2023-12-04,day,"Health Care, Internet, Software","Mill Valley, California, United States","ClassPass ($1B) for outdoor adventures - one membership for thousands of activities: free rental gear, events & 15-50% off activities","253,190",,,,,,,,,
Memorality,https://www.crunchbase.com/organization/memorality,Active,For Profit,,"Welcome to Memorality – the future of AI development, reimagined. At Memorality, we're revolutionizing the way AI solutions are created with our groundbreaking platform that combines the simplicity of drag-and-drop interfaces with the power of advanced AI technologies.",,2024-01-29,day,"Artificial Intelligence (AI), Developer Platform, Developer Tools, Generative AI, Machine Learning, Natural Language Processing",,"Unleashing AI's Potential, One Block at a Time.","253,492",,,,,,,,,
OneSix Energy,https://www.crunchbase.com/organization/onesix-energy,Active,For Profit,,,,2024-01-05,day,Clean Energy,"Detroit, Michigan, United States","Novel methane pyrolysis method for more efficient, economical, scalable conversion of methane into hydrogen and carbon black.","253,720",,,,,,,,,
Qoncert,https://www.crunchbase.com/organization/qoncert,Active,For Profit,2022-09-01,"Qoncert is a marketplace for independent artists to build their music careers through live performances.  It was founded in 2020 and is located in Denver, Colorado.",Undisclosed,2024-01-01,year,,"Denver, Colorado, United States",Qoncert is a marketplace for independent artists to build their music careers through live performances.,"255,409",,,,,USD,,,,
CloudGPT,https://www.crunchbase.com/organization/cloudgpt,Active,For Profit,,"CloudGPT is at the forefront of innovation in artificial intelligence, offering robust cloud-based solutions powered by advanced generative pre-trained transformer (GPT) technology. Our platform is designed to cater to businesses of all sizes, providing scalable services in natural language processing (NLP), machine learning (ML), and comprehensive data analytics. With CloudGPT, organizations can unlock powerful insights, automate complex processes, and enhance decision-making capabilities. Our commitment to excellence and customer success positions us as a leading provider in the AI tech space. Github: github.com/cloudgptllc Medium: medium.com/@cloudgpt Reddit: reddit.com/r/cloudgpt",,2024-02-01,day,"Information Technology, Software","Houston, Texas, United States","Cloud-based AI for NLP, ML, and data analytics using GPT tech. Scalable and innovative solutions for businesses.","257,407",,,,,,,,,
ELTRYS.,https://www.crunchbase.com/organization/eltrys,Active,For Profit,,,,2023-12-04,day,"Information Technology, Marketing, News, Online Portals","London, England, United Kingdom","ech & Marketing news and analysis with a focus on innovations, founders and startups.","258,252",,,,,,,,,
Wharf,https://www.crunchbase.com/organization/wharf,Active,For Profit,,,,2024-01-01,day,"Cloud Data Services, Software","New York, New York, United States",Wharf is an all-in-one platform that safeguards your entire data stack.,"260,230",,,,,,,,,
Mirabilis ai,https://www.crunchbase.com/organization/mirabilis-ai,Active,For Profit,,"Mirabilis.ai is an AI consulting firm that aims to help businesses get the most out of AI technology¹. They offer expert guidance and cutting-edge solutions to transform your data into insights, your processes into outcomes, and your vision into reality.  Their services include: - **Assessment**: Conducting a thorough assessment of your organization’s current state of AI adoption. - **Planning**: Developing a roadmap for implementing generative AI in your organization. - **Execution**: Implementing generative AI solutions in your organization. - **Monitoring and Optimization**: Monitoring the performance of the deployed AI solutions and optimizing them as needed. They are dedicated to helping you integrate AI into your company, working with you to understand your business goals, challenges, and opportunities. They offer solutions that deliver real value and results, and can help you automate processes, enhance customer experience, improve decision making, or generate new insights. Mirabilis.ai is passionate about AI and its potential to transform the world for the better. They have a team of experienced and skilled AI professionals who can assess, plan, and implement AI solutions for various domains and industries. They are committed to delivering high-quality, reliable, and scalable AI solutions that meet their clients’ expectations and requirements.",,2023-11-29,day,Artificial Intelligence (AI),"Montréal, Quebec, Canada",AI consulting firm dedicated to helping your organization integrate and deploy AI,"260,973",,,,,,,,,
E4RTH,https://www.crunchbase.com/organization/e4rth,Active,For Profit,2024-01-01,We create a new opportunity for people to invest in ecology. We let individuals invest in ecological projects using carbon certificates and make a profit from them by selling them to enterprises. Our model is B2B2C that provides sustainable investments,Pre-Seed,2023-12-21,day,"Financial Services, Impact Investing, Sustainability","Mainz, Rheinland-Pfalz, Germany",Invest in climate protection with profitable returns. Let your company buy Carbon Credits,"263,288",,,,,USD,,,,
Talent Disruptors,https://www.crunchbase.com/organization/talent-disruptors,Active,For Profit,,"Talent Disruptors was founded to rewrite the antiquated rules of recruitment and unlock better ways of building world-class teams. With an obsessive focus on assessing excellence, we rapidly identify and secure best-fit talent across the globe. Our proven, data-driven approach allows us to source, thoroughly vet, directly negotiate with, and rapidly deliver top-tier candidates tuned to each client’s specific business needs. As business operators and hiring managers ourselves, we know firsthand that competitive advantage lies in outstanding hires who deliver the right skills and mindset from day one. We translate those frontline insights into building motivated, future-proof teams that drive accelerated growth and next-level innovation. When you need to fill must-have positions with must-have talent, Talent Disruptors delivers.",,2023-12-21,day,"Recruiting, Staffing Agency","Alpharetta, Georgia, United States",Staffing & Recruiting Firm,"264,403",,,,,,,,,
Residua AI,https://www.crunchbase.com/organization/residua-ai,Active,For Profit,2024-02-28,,Pre-Seed,2024-01-01,month,"Artificial Intelligence (AI), Machine Learning, Software","New York, New York, United States",A selective AI co-presence that you can summon from anywhere into your digital world.,"264,987",,,,,USD,,0,,
Swapme AI,https://www.crunchbase.com/organization/swapme-ai,Active,For Profit,,"Swapme AI is an SaaS platform revolutionizing design by offering images enhance and upscale with a single click. Ideal for social, e-commerce, and print, ensuring stunning visuals every time. Our Enhancer app is currently available on Canva",,2024-02-01,day,"Generative AI, Graphic Design, SaaS, Web Apps, Web Design","Wilmington, Delaware, United States",Swapme AI developed a Generative AI technology revolutionizing images enhancing and upscaling,"265,225",,,,,,,,,
SaaSquare,https://www.crunchbase.com/organization/saasquare,Active,For Profit,2024-01-27,"SaaSquare is a dedicated marketplace for small-sized cloud and AI SaaS projects, connecting innovators with buyers seeking advanced digital solutions.  SaaSquare specializes in facilitating the sale of niche software projects, streamlining the discovery of cutting-edge tools.  SaaSquare ensures a seamless fast-paced transaction process without the excess paperwork and regulatory burdens. enhancing accessibility to innovative technologies.",Seed,2024-02-02,day,"Financial Services, Marketplace, Professional Services, SaaS","London, England, United Kingdom",Marketplace for Small-sized Cloud & AI Saas Projects,"265,295",,,,,USD,,,,
Founders Project,https://www.crunchbase.com/organization/founders-project,Active,For Profit,,"Dive into the hearts & minds of startup founders! The Founders Project shares inspiring stories & journeys behind the coolest new businesses. Get insider access, learn from the best, & be part of the future. We share founder interviews, startup stories, deep industry dives, case studies and news from the startup world.",,2024-01-01,month,"Communities, Education, Internet, News",,Newsletter about Startups and their Founders,"265,706",,,,,,,,,
Wunderlust Holidays,https://www.crunchbase.com/organization/wunderlust-holidays,Active,For Profit,2024-02-15,"Wunderlust Holidays offers unforgettable travel experiences, curating journeys that inspire wanderlust and create cherished memories. The company's mission is to take you on journeys beyond the ordinary, where you can immerse yourself in diverse cultures, explore breathtaking landscapes, and discover the world's hidden gems.",Angel,2024-01-12,day,"Hospitality, Travel Accommodations","Bangalore, Karnataka, India","Wunderlust Holidays offers unforgettable travel experiences, curating journeys that inspire wanderlust and create cherished memories.","266,353",,,,,USD,,,,
EVast Bio,https://www.crunchbase.com/organization/evast-bio,Active,For Profit,,"EVast Bio is a US-based, clinical-stage biotech born as a result of ground-breaking work at C4C (https://c4c.cl). EVast is devoted to unlocking the vast potential of Extracellular Vesicles (EVs) as therapeutics and delivery systems.",,2024-01-01,month,"Biotechnology, Life Science, Therapeutics",,Biotech company leveraging its clinical-stage platform of Extracellular Vesicles as both therapeutics and drug delivery systems.,"267,921",,,,,,,,,
Hashmi Ventures,https://www.crunchbase.com/organization/hashmi-ventures,Active,For Profit,,,,2023-12-17,day,,"Delaware, Ohio, United States",Hashmi Ventures is a strategic early stage venture capital firm focused on investing in seed & series A stage companies.,"268,432",,,,,,,,,
LiquidTF,https://www.crunchbase.com/organization/liquidtf,Active,For Profit,,LiquidTF is a marketplace focussed on digital items.,,2024-01-01,month,"E-Commerce Platforms, Gaming, Marketplace","Dover, Delaware, United States","E-Commerce, Gaming, Marketplace","269,874",,,,,,,,,
Tradenodes,https://www.crunchbase.com/organization/tradenodes,Active,For Profit,,Tradenodes is a new revolution in the world of crypto trading.Tradenodes.io is the first website that combines on-chain transactions in crypto with financial astrology to predict when the price of any coin will change its trend in the future.,,2024-01-28,day,Finance,"Karachi, Sindh, Pakistan",Tradenodes is a new gen technique for crypto leverage (future) trading.,"270,187",,,,,,,,,
GlobalSphere,https://www.crunchbase.com/organization/globalsphere,Active,For Profit,,"GlobalSphere - International PR Consulting, at the heart of our success lies a robust network of strategic partnerships. GlobalSphere has fostered direct connections with over 100 reputable media companies, all of which are prominent publishers of digital newspapers. We as a distinguished International PR Consulting firm headquartered in the vibrant city of Madrid, Spain. As one of the largest and most established networks of public relations work globally, we prides itself on delivering strategic communication solutions that transcend borders. Situated in Madrid, our headquarters symbolize the nexus of our global operations. The city's rich cultural tapestry and strategic location embody our commitment to bridging diverse perspectives and facilitating effective communication across international borders.  Choose GlobalSphere for a partner that understands the intricacies of international public relations, values the power of strategic media partnerships, and is dedicated to helping clients thrive in a globally interconnected world. Our passion for excellence and commitment to our clients' success make us a trusted leader in the realm of international PR consulting.",,2024-01-01,day,Public Relations,"Madrid, Madrid, Spain",International PR Consulting,"271,185",,,,,,,,,
MedDX,https://www.crunchbase.com/organization/meddx-b611,Active,For Profit,,"We are excited invite you to experience our innovative iOS app, MedDX! Our app is designed to harness machine learning calculators derived from esteemed academic sources to predict medical outcomes. Our overarching objective is to optimize the efficiency of prognosis prediction, risk stratification, and ultimately, enhance the overall performance of healthcare teams. As of the version 3.0 update, this application is available for iPhone, iPad and Mac computers.",,2024-01-04,day,"Education, Health Care, Health Diagnostics, Information Technology, Internet, Medical, Software","Savannah, Georgia, United States",A Crowdsourced Repository of Medical Peer-Reviewed Machine Learning Calculators on iPhone.,"271,731",,,,,,,,,
FileForms,https://www.crunchbase.com/organization/fileforms,Active,For Profit,,,,2024-01-01,day,"Business Development, Professional Services, Software","Fort Lauderdale, Florida, United States",FileForms is a BOI reporting company that offers FBAR filing and annual report services for businesses.,"272,249",,,,,,,,,
Disability Justice by Design,https://www.crunchbase.com/organization/iowa-department-of-education,Active,For Profit,,We a full service creative agency specializing in disability justice and practicing the ethics of disability justice.,,2023-12-28,day,Association,"Des Moines, Iowa, United States",Only for and by disability justice design firm in the world.,"272,480",,,,,,,,,
Digeto,https://www.crunchbase.com/organization/digeto,Active,For Profit,,"Digeto enables operational execution for impact-driven businesses that go global. Our integrated platform provides best-in-class services for:  • Market entry strategy  • HR  • Legal and Compliance  • Accounting and Tax  • Fundraising and Cash Management  • Logistics and Supply Chain  • ESG - embedded by design into our approach. Your benefits: Seamless, Fast, and Cost-Effective Operational Execution. Partner with Digeto now, where global reach meets local impact.",,2024-01-01,year,"Consulting, Digital Marketing, Food and Beverage, Information Technology, IT Management, Professional Services, Service Industry, Software, Technical Support","Rennes, Bretagne, France",We build a better world by empowering impact businesses to grow globally.,"273,129",,,,,,,,,
Juliette,https://www.crunchbase.com/organization/juliette-f6b8,Active,For Profit,,"Juliette is creating an easy-to-use 3D modeling software that lets you build models with just your hands, immensely boosting productivity. It’s designed for the upcoming Apple Vision Pro platform. This tool will make creating 3D models faster and a lot more enjoyable.",,2024-01-01,day,"3D Technology, Information Technology, IT Infrastructure","New York, New York, United States","Build 3D models with your hand. Juliette is creating hand-driven, revolutionary 3D modeling software for Vision OS.","274,087",,,,,,,,,
