Organization Name,Organization Name URL,Operating Status,Company Type,Last Funding Date,Full Description,Last Funding Type,Founded Date,Founded Date Precision,Industries,Headquarters Location,Description,CB Rank (Company),Last Funding Amount,Last Funding Amount Currency,Last Funding Amount Currency (in USD),Total Funding Amount,Total Funding Amount Currency,Total Funding Amount Currency (in USD),Number of Investors,Top 5 Investors,Number of Lead Investors
Alys Pharmaceuticals,https://www.crunchbase.com/organization/alys-pharmaceuticals,Active,For Profit,2024-02-12,Alys Pharmaceuticals engages in immuno-dermatology services. The company is reshaping the treatment landscape through advanced scientific innovations and a strong research and development-focused multi-platform pipeline. Alys emerged as a result of the strategic aggregation of 6 asset-centric companies backed by Medicxi.,Seed,2024-01-01,year,"Biotechnology, Health Care, Pharmaceutical","Boston, Massachusetts, United States",Alys Pharmaceuticals is a biopharmaceutical company focused on developing immuno-dermatology treatments.,37,100000000,USD,100000000,100000000,USD,100000000,1,Medicxi,1
Reken,https://www.crunchbase.com/organization/reken,Active,For Profit,2024-01-31,"Reken is an AI & cybersecurity firm building a new type of AI platform and products to protect against generative AI-enabled threats, including deepfake social engineering and automated fraud. The company was founded in 2024 and is based in San Francisco, California.",Seed,2024-01-01,day,"Artificial Intelligence (AI), Communications Infrastructure, Cyber Security, Fraud Detection, Information Technology, Machine Learning, Network Security, Security, Software","San Francisco, California, United States",Reken is an AI & cybersecurity firm building a new type of AI platform and products to protect against generative AI-enabled fraud.,164,10000000,USD,10000000,10000000,USD,10000000,10,"Fika Ventures, Jazz Venture Partners, Sequoia Scout, Greycroft, Firebolt Ventures",2
Bioptimus,https://www.crunchbase.com/organization/bioptimus,Active,For Profit,2024-02-20,"Bioptimus is a developer of a universal AI foundation model that connects biology at all sizes, from molecules to cells, tissues, and entire organisms. The company's technology turns multiscale data into actionable representations, allowing clients to spark breakthrough discoveries and expedite biomedical innovation.",Seed,2024-01-01,year,"Artificial Intelligence (AI), Biotechnology","Paris, Ile-de-France, France",Bioptimus is a developer of a universal AI foundation model for biology.,311,35000000,USD,35000000,35000000,USD,35000000,10,"Bpifrance, Sofinnova Partners, Owkin, Cathay Innovation, Hummingbird Ventures",1
Sema4.ai,https://www.crunchbase.com/organization/sema4-ai,Active,For Profit,2024-01-29,Sema4.ai's mission is to define the future of knowledge work by creating intelligent agents that alter how knowledge workers interact with AI.,Venture - Series Unknown,2024-01-01,year,"Artificial Intelligence (AI), Software, Web Development",,Sema4.ai's mission is to define the future of knowledge work by creating intelligent agents that alter how humans engage with AI.,592,30500000,USD,30500000,30500000,USD,30500000,3,"Canvas Ventures, Benchmark, Mayfield Fund",
Calluna Pharma,https://www.crunchbase.com/organization/calluna-pharma,Active,For Profit,2024-01-23,"Calluna has developed a robust pipeline of selective antibodies, targeting immunological diseases. These include novel therapeutic candidates that fulfill unmet clinical needs across a spectrum of diseases.",Series A,2024-01-01,year,"Biotechnology, Pharmaceutical","Oslo, Oslo, Norway",Calluna Pharma is developing first-in-class therapies designed to defeat chronic inflammation and fibrosis at the source.,"1,263",75000000,EUR,81654960,75000000,EUR,81654961,4,"Forbion Capital Partners, Investinor, Sarsia, p53",
Power global investors,https://www.crunchbase.com/organization/power-global-investor-s,Active,For Profit,,,,2024-02-24,day,"Banking, Finance, Financial Services, Venture Capital",,Power global investors is a company that invests money in companies,"1,805",,,,,,,0,,0
Ocular AI,https://www.crunchbase.com/organization/ocular-ai,Active,For Profit,2024-02-01,"Ocular is a Cloud and Artificial Intelligence company, backed by Y Combinator, bringing Enterprise AI and Search to the Workplace and Engineering.",Pre-Seed,2024-01-01,year,"Artificial Intelligence (AI), B2B, Cloud Infrastructure, Generative AI, Machine Learning, SaaS","San Francisco, California, United States",Enterprise AI and Search for the Workplace and Engineering.,"4,571",500000,USD,500000,500000,USD,500000,1,Y Combinator,1
Nim,https://www.crunchbase.com/organization/nim-9306,Active,For Profit,2024-02-07,,Pre-Seed,2024-01-31,day,"Artificial Intelligence (AI), Generative AI","Denver, Colorado, United States",Generative Video for Professionals,"11,828",700000,USD,700000,700000,USD,700000,4,"SignalFire, Siqi Chen, Great Oaks Venture Capital, Trent Herren",1
Cleve,https://www.crunchbase.com/organization/cleve,Active,For Profit,2024-01-31,Cleve.ai is a building Gen AI solutions that help creators build their brand.,Pre-Seed,2023-12-04,day,"Internet, Marketing, Software","Kuala Lumpur, Kuala Lumpur, Malaysia",Cleve.ai is a building Gen AI solutions that help creators build their brand.,"14,670",110000,USD,110000,110000,USD,110000,1,Antler,1
Arini,https://www.crunchbase.com/organization/arini,Active,For Profit,2024-02-19,"Arini is an AI receptionist for dental practices that answers phone calls, and schedules appointments.",Pre-Seed,2024-01-01,day,,"San Francisco, California, United States",The AI Receptionist for Dentists,"15,143",500000,USD,500000,500000,USD,500000,1,Y Combinator,
Zhongyu Youtuo,https://www.crunchbase.com/organization/zhongyu-youtuo,Active,For Profit,2024-02-05,"Zhongyu Youtuo Network Technology is dedicated to constructing a platform for entertainment living and offering regional services. The company's primary goals are to expand the market, maximize the sales of both its online and physical shopping centers, and construct an entire ecological chain.",Seed,2024-01-01,year,"Media and Entertainment, Shopping, Social Network","Jiulongpo, Chongqing, China",Zhongyu Youtuo Network Technology is dedicated to constructing a platform for entertainment living and offering regional services.,"15,743",30000000,CNY,4168577,30000000,CNY,4168577,,,
GoldenBasis,https://www.crunchbase.com/organization/goldenbasis,Active,For Profit,2024-01-16,GoldenBasis is a B2B fintech company that aims to help self-clearing firms receive account transfers with AI.,Pre-Seed,2024-01-09,day,FinTech,"San Francisco, California, United States",GoldenBasis is a B2B fintech company that aims to help self-clearing firms receive account transfers with AI.,"16,187",500000,USD,500000,500000,USD,500000,1,Y Combinator,1
revitalyze,https://www.crunchbase.com/organization/revitalyze,Active,For Profit,2024-01-15,revitalyze is an award-winning greentech platform that enables a circular construction industry through a unique approach to the reuse of circular building materials.,Pre-Seed,2024-01-01,year,"Building Material, Green Building, Logistics, Recycling, Social Impact","Innsbruck, Tirol, Austria",revitalyze is an award winning one-stop shop for the reuse of circular building materials,"18,020",80000,EUR,87585,140000,EUR,151447,3,"aws Fondsmanagement GmbH, Austria Wirtschaftsservice (AWS), Start-up Center Start Up Tirol GmbH",1
NVolume,https://www.crunchbase.com/organization/nvolume,Active,For Profit,2024-02-15,"At NVolume (&Volume), we develop advanced AI/ML models that autonomously engage in digital currency trading.  We crafted a user-friendly platform that allows even those without extensive expertise to sidestep FOMO (Fear of Missing Out) and seizing opportunities in this dynamic market. By sharing these models with users, we enable them to select the most suitable risk level, offering a range of options to make cryptocurrency trading more accessible and effective.",Seed,2024-01-01,year,"Artificial Intelligence (AI), Blockchain, Cryptocurrency, FinTech, Generative AI, Machine Learning, SaaS, Web3","Edinburgh, Edinburgh, City of, United Kingdom",We develop advanced AI/ML models that autonomously engage in digital currency trading,"19,823",,,,285000,USD,285000,2,"Amazon Web Services, Vladimir Weisseman",2
Coalignment,https://www.crunchbase.com/organization/coalignment,Active,For Profit,2024-01-15,Coalignment is an independent research lab aligning AI with human preferences.,Pre-Seed,2024-01-01,year,Artificial Intelligence (AI),"Yogyakarta, Yogyakarta, Indonesia",Coalignment is an independent research lab aligning AI with human preferences.,"20,975",1000000,USD,1000000,1000000,USD,1000000,,,
First Bite,https://www.crunchbase.com/organization/first-bite-656c,Active,For Profit,2024-02-08,First Bite is a go-to-market software platform for food manufacturers.,Seed,2024-01-01,year,,"Redwood City, California, United States",First Bite is a go-to-market software platform for food manufacturers.,"21,744",2000000,USD,2000000,2000000,USD,2000000,2,"Bread and Butter Ventures, Leadout Capital",1
Akela Hub,https://www.crunchbase.com/organization/akela-hub,Active,For Profit,2024-02-21,Akela Hub is an AI-powered platform enabling innovators to find solutions to their difficulties.,Seed,2024-01-01,year,"Internet, Software","South Holland, Illinois, United States",Akela Hub is an AI-powered platform enabling innovators to find solutions to their difficulties.,"22,059",1000000,EUR,1081305,1000000,EUR,1081306,2,"Unknown Group, Giels Brouwer",1
Trident AI,https://www.crunchbase.com/organization/trident-ai-4fe3,Active,For Profit,2024-02-04,"Trident's mission is to build a world of zero fraud victims. AI-enabled fraud needs to be fought by AI-enabled investigators. That’s why we’re building AI fraud investigators to help banks and fintechs around the world keep up with the rising rates of fraud and scams, and protect their customers.",Pre-Seed,2024-01-01,day,"Artificial Intelligence (AI), Banking, Cyber Security, Financial Services, FinTech, Fraud Detection, Machine Learning","San Francisco, California, United States","AI Fraud Investigators for Banks and Fintechs, B2B SaaS","22,837",125000,USD,125000,125000,USD,125000,1,Entrepreneur First,1
HOTELA CITIES,https://www.crunchbase.com/organization/hotela-d49d,Active,For Profit,2023-08-08,"""HOTELA Cities is an innovative urban development company revolutionizing luxury living in the world's most vibrant cities. We specialize in creating self-sustaining, technologically advanced 'cities within cities' that redefine urban luxury. Our developments blend high-end accommodations with exclusive amenities, fostering a lifestyle of comfort, community, and sustainability. With a strategic global expansion plan targeting 30 key locations, HOTELA Cities is at the forefront of shaping the future of urban living, offering unparalleled experiences in luxury, technology, and eco-friendly living. Currently, we are mobilizing our team to ignite our visionary journey, inviting investors to partake in reimagining city life for the modern era.""",Seed,2024-01-12,day,"PropTech, Smart Cities","Tokyo, Tokyo, Japan",HOTELA Cities: Pioneering luxury urban living with phase 1's fractional home ownership in global cities.,"24,080",250000000,JPY,1745022,250000000,JPY,1745022,,,
newmo,https://www.crunchbase.com/organization/newmo,Active,For Profit,2024-02-16,newmo delivers sustainable local public transportation create a user experience (UX) that people may utilize with peace of mind and comfort.,Seed,2024-01-04,day,"Public Transportation, Service Industry, Transportation","Tokyo, Tokyo, Japan",newmo delivers sustainable local public transportation.,"26,667",1500000000,JPY,9985019,1500000000,JPY,9985020,14,"ANRI, JAFCO, DCM Ventures, Incubate Fund, Money Forward Venture Partners",
SPUN,https://www.crunchbase.com/organization/spun-a72e,Active,For Profit,2023-01-08,"Our mission at SPUN is to make exploring the world easier by minimizing administrative hassles, so you can focus on the adventure, not the paperwork. Our platform can help you with visa, work permit, housing, and more! Hassle-free, quick help when you need it the most. Save time and don’t worry about your traveling and relocating logistics any longer.",Pre-Seed,2023-12-01,month,"Document Management, Information Technology, Software, Travel","Jakarta, Jakarta Raya, Indonesia",Modernizing global permit & visa creation to pursue global opportunities,"27,525",125000,USD,125000,125000,USD,125000,1,Antler,1
TensorWave,https://www.crunchbase.com/organization/tensorwave,Active,For Profit,2024-01-23,TensorWave helps businesses leverage the potential of artificial intelligence and develop advanced AI-based software. It was founded in 2023.,Seed,2023-12-01,month,"Artificial Intelligence (AI), Cloud Computing, Cloud Infrastructure, Generative AI, IaaS","Las Vegas, Nevada, United States",TensorWave helps businesses leverage the potential of artificial intelligence and develop advanced AI-based software.,"28,140",2328000,USD,2328000,2328000,USD,2328000,1,FundNV,1
Vinter.me,https://www.crunchbase.com/organization/vinter-me,Active,For Profit,2023-12-01,"Vinter is a AI Based SaaS platform that allows employers to manage their recruitment processes by offering them a modern and digital approach.  It enables candidate assessments to be carried out in a more agile, objective, efficient and flexible way by developing with artificial intelligence and enabling asynchronous process management.   Vinter aims to be the best supporter of the recruitment teams!",Pre-Seed,2023-12-01,month,"Artificial Intelligence (AI), Human Resources, Recruiting","London, England, United Kingdom",AI Based SAAS Recruitment Platform,"28,575",1000000,EUR,1089258,1000000,EUR,1089258,1,Alcora,
Onedoc,https://www.crunchbase.com/organization/codemuse,Active,For Profit,2023-12-12,"Documents for developers. The first developer-oriented document platform. Generate, host and track documents with a single API, beautifully.",Pre-Seed,2023-12-12,day,"Information Technology, Software","San Francisco, California, United States","Documents for developers. The first developer-oriented document platform. Generate, host and track documents with a single API, beautifully.","28,622",125000,USD,125000,125000,USD,125000,1,Y Combinator,1
DGTLsuite,https://www.crunchbase.com/organization/dgtlsuite,Active,For Profit,2023-11-01,"Customer expectations are consistently being reshaped by sweeping advances in technology and high-quality digital customer experience is expected in every brand’s online interactions. The SaaS model of DGTLsuite solves the four largest problems businesses face in meeting the demands of their customers online: digital community management, customer care service automation, creative content logistics, and actionable insights from analytics.",Seed,2024-01-08,day,"B2B, Natural Language Processing, SaaS, Software","San Antonio, Texas, United States","DGTLsuite is a B2B SaaS platform where marketing, customer care, and digital come together come together to create happy customers!","33,778",1154100,USD,1154100,1154100,USD,1154100,,,
6S Pharma,https://www.crunchbase.com/organization/6s-pharma-inc,Active,For Profit,2024-02-20,"6S is an IND stage company with multiple 505 b2 products in the pipeline along with a pipeline of high-value complex generic products in the pipeline. With a commitment to improving lives and advancing the field of medicine, the company conducts rigorous research and development activities to create novel pharmaceutical products and therapies. The team at 6S Pharma comprises highly skilled scientists, researchers, and professionals who work tirelessly to address unmet medical needs and enhance patient well-being.",Seed,2023-12-01,month,"Health Care, Pharmaceutical","Belle Mead, New Jersey, United States","6S Pharma is a dedicated pharmaceutical research company, focused on developing innovative healthcare solutions.","33,915",150000,USD,150000,550000,USD,550000,,,
UpBrand,https://www.crunchbase.com/organization/upbrand-4ba1,Active,For Profit,2023-12-25,"UpBrand: Transforming Vietnamese manufacturers into global lifestyle brands by providing AI-driven market insights, innovative brand development tools, and comprehensive e-commerce integration solutions.",Pre-Seed,2023-12-20,day,"Brand Marketing, E-Commerce, E-Commerce Platforms, Information Technology, Internet, Sales","Ho Chi Minh City, NA - Vietnam, Vietnam",D2C Brand & E-commerce Enabler For Lifestyle Manufacturers,"36,560",110000,USD,110000,110000,USD,110000,1,Antler,1
Invisum Ai,https://www.crunchbase.com/organization/invisum-ai,Active,For Profit,2024-01-05,InVisum AI specializes in different types of AI-driven facial/object recognition software for the intelligence community & savvy businesses that need an edge over their competition.,Debt Financing,2024-01-05,day,"Law Enforcement, Public Safety, SaaS","Brasov, Brasov, Romania",AI-driven facial/object recognition software,"38,251",500000,EUR,547735,500000,EUR,547735,1,Leryon Holdings,1
"Appremon, Inc.",https://www.crunchbase.com/organization/appremon-inc,Active,For Profit,2024-01-26,,Pre-Seed,2024-01-16,day,"Cyber Security, Information Technology, Manufacturing",,"SaaS, Cybersecurity, Cloud Security, Hybrid Security","39,588",31000,USD,31000,31000,USD,31000,,,
Carecircle,https://www.crunchbase.com/organization/carecircle,Active,For Profit,2023-01-01,"carecircle (www.carecircle.org) is the world's first global independent hyperscale social network and platform for health and wellness. Connecting and empowering members to diagnose symptoms, track their health journey, share health stories, discover treatment options, and access medical experts. carecircle allows users to take control of their most important possession: their health. carecircle has raised $2m in pre-seed funding and recently launched in 158 countries. As a member of the Microsoft for Startups program and the exclusive Microsoft Pegasus accelerator program for future unicorns, carecircle and Microsoft are partnering to take a lead in consumer healthcare around the world (https://bit.ly/37DLE5c). carecircle is a research partner of the Swiss Federal Institute of Technology in Zurich (ETH Zurich), a research partner of Swiss Innovation Agency Innosuisse ( https://bit.ly/3wZiAio), and a partner of the World Health Organisation (WHO) Programme for International Drug Monitoring in Uppsala, Sweden. carecircle is currently scaling its user community and is poised to become the largest, most trusted consumer health and wellness platform in the world. carecircle is ""the world's health service"" (TM).",Venture - Series Unknown,2024-01-01,year,Health Care,"Northwich, Cheshire, United Kingdom",carecircle is the world's first global independent hyperscale social network and platform for health and wellness.,"40,369",,,,4289095,USD,4289095,3,"Innosuisse, ZCG, Pearl Street",1
homo ex machina,https://www.crunchbase.com/organization/homo-ex-machina,Active,For Profit,2024-01-01,"Quantum Leap of Progress in Serving Humanity with AGI At homo ex machina, we aim to be at the forefront of General Artificial Intelligence (AGI). Our goal is to develop AGI systems that are not only technically advanced but also ethically responsible and socially beneficial.  Our team, composed of dedicated Post-Doctoral researchers, is passionately committed to the belief that contributing to the development of Artificial General Intelligence (AGI) represents the most significant contribution to human history. Our focus lies in advancing the field through research in Large Language Model optimization and the development of innovative algorithms for neuromorphic hardware.",Pre-Seed,2024-01-01,day,"Artificial Intelligence (AI), Generative AI, Natural Language Processing","Heidelberg, Baden-Wurttemberg, Germany","Artificial Intelligence, Generative AI, Large Language Models, Neuromorphic Hardware","41,603",500000,EUR,551831,500000,EUR,551831,0,,0
Peas,https://www.crunchbase.com/organization/peas,Active,For Profit,2024-01-22,,Pre-Seed,2024-01-01,year,"Artificial Intelligence (AI), FinTech",,"Peas is a horizontal banking layer for couples to split expenses, save together and earn rewards.","41,642",200000,USD,200000,200000,USD,200000,2,"Techstars, Grant Gurtin",
Thyrasec,https://www.crunchbase.com/organization/thyrasec,Active,For Profit,2023-12-15,"We're on a mission to help build a better world by helping companies launch secure connected to the market. With the world evermore connected, security has become a critical aspect of every connected product. At Thyrasec we help secure those products with world-class technology expertise at all product levels, from the design, to the hardware, firmware, protocols and mobile applications",Pre-Seed,2023-12-01,month,"Cyber Security, Information Technology, Wireless","Plano, Texas, United States",Wireless Product Cybersecurity,"41,908",500000,USD,500000,500000,USD,500000,,,
SmartPAR,https://www.crunchbase.com/organization/smartpar,Active,For Profit,2024-01-22,"Empowering Healthcare with AI-Driven Inventory Management At SmartPAR, our journey began with a clear and ambitious goal: to revolutionize hospital inventory management using the power of artificial intelligence. We envisioned a system that not only streamlines inventory processes but also provides healthcare institutions with unprecedented access to critical data, enabling better decision-making and enhancing patient care. The concept of SmartPAR transformed from an idea into reality in late 2023. Supported by venture funding, we have brought together a team of experts, boasting a collective experience of over a thousand years, dedicated to pushing the boundaries of what's possible in healthcare technology. “Advancing healthcare through adaptable and innovative inventory management solutions.”   Smart Sync Imagine your current inventory and supply chain management tools evolving to work seamlessly in your favor. Our innovative system is designed to seamlessly integrate with your existing infrastructure, enhancing operations with a user-centered approach. Leveraging cutting-edge artificial intelligence (AI), we revolutionize product identification by capturing global product icons directly from packaging. This flexibility allows us to position scanners at strategic points preferred by your team, optimizing workflow efficiency. The immediate synchronization of this data with your inventory and supply chain software ensures real-time accuracy and operational excellence. Universal Product Catalog Hospitals nationwide are burdened with the time-consuming task of manually entering products into their inventory systems. Recognizing this challenge, we've harnessed data directly from the FDA's 510(k) Premarket Notification database, alongside exclusive partnerships with leading Medical Device Companies. This collaboration has empowered us to develop a comprehensive, universal product catalog. Our catalog is meticulously maintained and updated daily, ensuring that your inventory management and supply chain software are always current with the latest product information. This innovative solution not only streamlines the inventory process but also grants immediate access to essential updates, significantly reducing manual data entry and enhancing operational efficiency. Data Insights Introducing our Artificial Intelligence and Learned Language Data Reporting System: a revolutionary tool designed to empower your hospital team with instant access to critical data and reports. Is your team currently facing delays in accessing the information they need? Are you reliant on an IT department that takes weeks to respond to requests? Our solution transforms these challenges into a thing of the past. With our system, you gain the ability to request any report or dashboard directly from your existing systems - effortlessly and instantly. Once integrated, our advanced learned language model allows users to interact with the system using simple prompts. This means you can ask for the specific report you need, when you need it, without any technical expertise or waiting period. Streamline your data access, enhance decision-making, and elevate patient care with our AI-driven reporting system.",Debt Financing,2024-01-01,month,,"Haddonfield, New Jersey, United States",Advancing healthcare through adaptable and innovative inventory management solutions.,"43,416",1000000,USD,1000000,1250000,USD,1250000,1,Kings Ventures,1
Yet Another Company,https://www.crunchbase.com/organization/yet-another-company,Active,For Profit,2024-01-29,Another company provides internet users globally with improved access to a variety of financial goods including by employing blockchain technology.,Pre-Seed,2024-01-01,year,"Blockchain, Financial Services, FinTech, Information Technology","Argentina, Alajuela, Costa Rica",Another company provides internet users globally with improved access to a variety of financial goods.,"43,727",1000000,USD,1000000,1000000,USD,1000000,4,"C² Ventures, LambdaClass, Gagra Ventures, Fred ..",1
Orcus,https://www.crunchbase.com/organization/orcus,Active,For Profit,2024-01-05,"Orcus empowers any organization to test with ease and integrity, continuously protecting cyber assets while mitigating true risk exposure. Orcus was founded in 2024 and is based in Wilmington, Delaware.",Seed,2024-01-01,month,,"Wilmington, Delaware, United States","Orcus empowers any organization to test with ease and integrity, continuously protecting cyber assets while mitigating true risk exposure.","44,400",1500000,USD,1500000,1500000,USD,1500000,,,
